hotel_id,block_id,data
149,1,Hồ bơi ngoài trời với diện tích lớn bên trong khuôn viên khách sạn
149,2,"Nhà hàng chuyên phục vụ các món Á - Âu có không gian mở, sức chứa đến 70 khách"
149,3,"Một số tiện ích khác: Wifi, bãi đậu xe, nhà hàng, quầy bar trong khuân viên,..."
150,1,"Vị trí gần nhiều điểm vui chơi tham quan: chợ đêm Dương Đông, Dinh Cậu,..."
150,2,Nhà hàng nằm ở tầng 8 khách sạn và quán bar trên sân thượng.
150,3,Phòng họp sức chứa khoảng 40 người
150,4,"Tiện ích khác: oto cho thuê,..."
151,1,"Là nơi được lựa chọn để trải nghiệm chuyến nghỉ dưỡng, La Vela Hotel Huế luôn trân trọng giây phút được tiếp đón và chăm sóc tận tâm từng quý khách hàng"
151,2,"Với phương châm đặt sự hài lòng của khách hàng lên hàng đầu, đội ngũ La Vela luôn gây ấn tượng đẹp với du khách ngay từ những bước chân đầu tiên và hứa hẹn sẽ đem lại những trải nghiệm tốt nhất dành cho khách hàng cho kỳ nghỉ tuyệt vời"
151,3,"Đến với La Vela Hue Hotel là điểm hẹn gửi gắm những trải nghiệm được nâng tầm, trải nghiệm các món ăn thuần vị Huế tại nhà hàng Nhã Viên lại vẹn tròn, hoàn hảo với không gian truyền thống, cổ kín và sang trọng"
151,4,"Tận hưởng kì nghỉ với sự thư thái đúng điệu tại La Vela Hue Hotel. Thư giãn và thưởng thức không gian sang trọng và ấm cúng, mọi khoảnh khắc yên bình của thành phố như hiện ra ngay trước mắt."
152,1,"Bạn sẽ được ngắm nhìn quang cảnh sông Hương và vườn bưởi trong phòng nghỉ dưỡng sang trọng, thanh lịch này."
152,2,"Hue Riverside Resort là một điểm đến lý tưởng cho những ai muốn tìm kiếm một nơi yên tĩnh, thanh bình"
152,3,"Khám phá Hue Riverside Resort - nơi bạn có thể kết nối với thiên nhiên, tận hưởng những khoảnh khắc yên bình bên người thân yêu."
152,4,"Với vị trí đắc địa bên bờ sông Hương, tất cả các phòng của resort đều có view sông, mang lại cảm giác thư thái và bình yên"
153,1,"Vị trí thuận lợi, chỉ cách trung tâm Cát Bà và bãi biển Cát Cò 5 phút đi bộ"
153,2,Có bể bơi ngoài trời lý tưởng cho du khách thư giãn ngắm hoàng hôn
153,3,"Các tiện ích khác: nhà hàng, bể bơi bốn mùa, thuê xe máy,..."
154,1,"Không chỉ cung cấp cho quý khách không gian tổ chức sang trọng và trang thiết bị hiện đại, The Reed Hotel còn có đội ngũ nhân sự vừa chuyên nghiệp vừa nhiệt tình, luôn sẵn sàng cho mọi sự kiện."
154,2,The Reed Hotel sẽ mang đến không gian sân vườn thoáng đãng cho những trò chơi thú vị của cả team cùng nhiều dịch vụ tổ chức sự kiện cao cấp
154,3,The Reed Hotel chính là địa điểm lý tưởng để các đơn vị tạo nên những dấu ấn khó phai tại buổi Team Building có 1-0-2 cho nhân sự.
154,4,"Khách sạn phục vụ đa dạng các loại hình Team Building từ indoor, outdoor hay kết hợp cùng ẩm thực"
155,1,"Với 35 phòng tiêu chuẩn và suite, Khách sạn được thiết kế sang trọng với nội thất cao cấp cùng nhiều dịch vụ tiện ích như sky bar, hồ bơi vô cực, bể sục nước nóng, phòng xông hơi & spa, khu tổ chức BBQ, team building,kid club……"
155,2,"Các phòng đều có cửa sổ hướng ra núi, hồ sen, hoặc cánh đồng. Khách sạn Lalita Boutique Hotel & Spa Ninh Binh sẽ là sự lựa chọn lý tưởng cho du khách khi ghé thăm Cố Đô Ninh Bình."
155,3,"Khách sạn nằm trong lòng Tam Cốc- Bích Động, trung tâm của Di sản thiên nhiên và văn hóa thế giới Tràng An, khách sạn Lalita Boutique Hotel & Spa Ninh Binh xuất hiện như một tòa lâu đài đẹp lộng lẫy bên hồ sen."
156,1,Sở hữu bể bơi trong nhà và ngoài trời diện tích rộng
156,2,"Hệ thống nhà hàng và quán bar phục vụ thực đơn da dạng, phong phú các món ăn đặc sản tươi sống"
156,3,Phòng hội họp được thiết kế sang trọng trang bị đầy đủ tiện nghi cần thiết
156,4,"Tiện ích khác: dịch vụ Spa, dịch vụ BBQ, quán coffee,.."
157,1,"Tọa lạc tại trung tâm của Phú Quốc, nằm ngay sát các địa danh nổi tiếng như: Long beach, chợ Dương Đông,.."
157,2,Bể bơi ngoài trời nằm giữa rừng nhiệt đới nguyên sinh tạo nên một bầu không khí thanh bình và thư giãn.
157,3,"Hệ thống nhà hàng & bar sang trọng nhưng không kém phần ấm cúng, phục vụ nhiều món ăn độc đáo bao gồm: Nhà hàng Garden, Del Sol, Lê Việt Cafe, Cheers Bar."
157,4,"Phòng hội thảo có đầy đủ trang thiết bị hiện đại cùng không gian rộng rãi, có sức chứa khoảng 50 khách."
157,5,"Những tiện ích khác: Spa, phòng gym, hoạt động giải trí trên biển, cửa hàng lưu niệm, dịch vụ trông trẻ,..."
158,1,Vị trí thuận lợi để di chuyển đến các địa điểm nổi tiếng của Phú Quốc
158,2,Bãi biển riêng và hồ bơi ngoài trời cực rộng với nhiều hoạt động vui chơi giải trí trên biển
158,3,Nhà hàng Chez Carole phục vụ đa dạng các món ăn Á - Âu
158,4,"Tiện ích khác: Spa, phòng tập Gym, ...."
159,1,"Vị trí thuận lợi cách trung tâm thị trấn Dương Đông 12km, sân bay 6km"
159,2,Bể bơi ngoài trời diện tích hơn 110m2 có khu vực cho người lớn và trẻ em
159,3,"Hệ thống nhà hàng - Bar phục vụ đa dạng ẩm thực vùng biển: Nhà hàng An Thới, Coral Bar, Sunny Bar, Rooftop Bar, ..."
159,4,"Phòng tiệc, hội nghị hiện đại với sức chứa từ 40 – 450 khách"
159,5,"Tiện ích khác: dịch vụ Spa, Gym, Tennis, Karaoke, ..."
160,1,Nằm cách bãi biển chỉ 100m với view hướng biển
160,2,Bể bơi ngoài trời góc nhìn thoáng rộng
160,3,Nhà hàng với thực đơn đa dạng và phong phú
160,4,"Các dịch vụ tiện ích khác: phòng thể dục, quầy đặt tour,..."
161,1,"Thiết kế nhằm tái hiện lại khu chợ sôi động ngày xưa, phong cách trang trí đặc trưng như trưng bày các sản phẩm gốm sứ lạ mắt, mô phỏng bàn tính cổ điển của cảng thương mại sầm uất bằng gỗ và nhiều lớp ngói lợp bằng gốm được sắp xếp tinh xảo sẽ đưa bạn trở về một thời đã qua thực sự."
161,2,"Với hồ bơi rộng rãi, thoáng mát, nhiều cây xanh, Pool Bar là nơi để bạn thư giãn sau một ngày tham quan di tích lịch sử, văn hóa khi đến Hội An hay đơn giản là chuyến đi nghỉ cuối tuần."
161,3,"Không gian nội thất bắt đầu hành trình khám phá văn hóa địa phương của bạn với các bộ sưu tập tác phẩm nghệ thuật, văn học và hiện vật"
161,4,"Serene Nature Hotel là một tác phẩm nghệ thuật tự thân, mỗi ngóc ngách đều được tô điểm bằng những tác phẩm kết nối với câu chuyện lớn hơn."
162,1,"Khách sạn ÊMM Hội An đáp ứng mọi nhu cầu nghỉ dưỡng với 05 hạng phòng được thiết kế hiện đại, tiện nghi và sạch sẽ chuẩn quốc tế."
162,2,"Khách sạn ÊMM Hội An được trang bị đầy đủ các dịch vụ & tiện ích từ ăn uống, giải trí, làm đẹp… nhằm mang lại trải nghiệm nghỉ dưỡng trọn vẹn nhất."
162,3,"Khách sạn mang đến sự kết hợp hoàn hảo giữa nét hiện đại và cổ kính, với không gian trong lành và tiện nghi đẳng cấp, cho bạn trải nghiệm trọn vẹn Hội An vào thời khắc đẹp nhất này."
163,1,Nhà hàng ăn sáng nằm cạnh hồ bơi của khách sạn với không gian thoáng đãng và gần gũi với thiên nhiên cùng thực đơn hấp dẫn
163,2,"Hồ bơi Rooftop nằm giữa khu vườn xanh mát trên cao, sử dụng công nghệ muối điện phân thân thiện với làn da của bạn"
163,3,"Dịch vụ cho thuê xe máy, ô tô luôn sẵn sàng đưa bạn đến mọi nơi"
164,1,"Bể bơi ngoài trời nằm trên sân thượng, sở hữu không gian rộng rãi, thoáng mát và tầm nhìn ra toàn thành phố"
164,2,Nhà hàng Mento phục vụ thực đơn Âu - Á đa dạng
164,3,"Dịch vụ Spa, xông hơi bằng đá muối Himalaya"
164,4,"Tiện ích khác: lễ tân 24/24, dọn phòng hàng ngày,..."
165,1,Bể bơi vô cực với tầm nhìn bao quát toàn bộ khung cảnh thành phố biển
165,2,"Nhà hàng Canary Gold và Canary Gold Sky Lounge sở hữu menu ẩm thực, thức uống đa dạng"
165,3,"Phòng hội họp trang bị đầy đủ thiết bị âm thanh, ánh sáng"
165,4,"Dịch vụ tiện ích khác: Spa, phòng tập Gym,..."
166,1,"Các phòng đều được thiết kế và trang trí trang nhã theo phong cách hiện đại và tinh tế, với phần lớn các căn hộ mang hơi thở cổ điển – với tầm nhìn ra Bãi biển An Bàng rực rỡ."
166,2,"Bên cạnh đó, đội ngũ nhân viên tận tâm và giàu kinh nghiệm của khu nghỉ dưỡng luôn sẵn sàng phục vụ, mang đến cho du khách những trải nghiệm trọn vẹn nhất."
166,3,"Toạ lạc tại thành phố Hội An di sản, Citadines Pearl Hoi An là sự lựa chọn lý tưởng với các tiện nghi hàng đầu, mang đến cho quý khách một kỳ nghỉ thoải mái và thú vị nhất."
166,4,"Citadines Pearl Hoi An sẽ làm bạn hài lòng với lễ cưới đẹp như mơ bên bờ biển An Bàng hoang sơ xinh đẹp và bãi cát trắng mịn. Dù là phong cách hiện đại hay truyền thống, sang trọng hay là nhẹ nhàng ấm cúng."
167,1,"Nhà hàng tại Hội An Babylon Luxury Hotel & Spa là nhà hàng phục vụ bữa sáng tự chọn và hơn thế nữa, cung cấp cho du khách các món ăn truyền thống Việt Nam và các món ăn phương Tây phù hợp với mọi khẩu vị, sử dụng tất cả nguyên liệu có nguồn gốc địa phương"
167,2,"Khám phá liệu pháp truyền thống Việt Nam bao quanh bởi vườn thảo dược, spa là một nơi trú ẩn hẻo lánh nơi có tiếng nước chảy và mùi tinh chất tự nhiên."
167,3,"Khách sạn nằm cách Trung tâm phố cổ Hội An 900m, gần bãi đỗ xe trung tâm phố cổ, thuận tiện cho du khách di tham quan phố cổ hoặc có thể đi bộ để ngắm phố, khách sạn cũng cung cấp miễn phí xe đạp cho khách dạo chơi phố cổ & xe đưa đón ra biển An Bàng theo lịch trình khách sạn."
168,1,"Khám phá năng lượng nhộn nhịp của Phố cổ Hội An, hoặc mạo hiểm đến Huế và Đà Nẵng - tất cả đều dễ dàng tiếp cận."
168,2,"Nhà hàng Sowing và quầy bar tầng thương FiEELd của Rêu Hotel Hội An dệt nên bức tranh ẩm thực phong phú, tôn vinh hương vị của nguyên liệu địa phương. Hãy bắt đầu một cuộc phiêu lưu ẩm thực, nơi mỗi món ăn và thức uống mang đến cho bạn những trải nghiệm mới mẻ."
168,3,"Tọa lạc giữa cánh đồng lúa xanh mát, chỉ cách Phố cổ Hội An 5 phút, Rêu là nơi lý tưởng để bạn tận hưởng không khí trong lành và khám phá vẻ đẹp cổ kính của phố cổ Hội A"
169,1,"Khách sạn 5 sao Hội An Cozy Savvy Boutique sau bao năm xây dựng và phát triển, giờ đây đã có được cho mình những thành tựu nhất định. Khu nghỉ dưỡng lấy được niềm tin của khách hàng"
169,2,Khách sạn Cozy Savvy Boutique thiết kế thiên về kiểu hướng hiện đại. Tất cả các đường nét chạm khắc ở đây đều ẩn hiện một ý nghĩa nào đó khó nói.
169,3,"Khách sạn Hội An Cozy Savvy Boutique có diện tích khá rộng. Toàn bộ khuôn viên có trông và trang trí nhiều cây xanh mát, tạo không gian rộng mở thoải mái."
169,4,Cozy Savvy Boutique sau bao năm vẫn giữ được nét đẹp truyền thống xưa. Nét thiết kế xen lẫn cả hiện đại và cổ điển đã tạo nên được một công trình mới lạ đặc sắc.
170,1,Bể bơi vô cực với tầm nhìn bao quát toàn bộ khung cảnh thành phố biển
170,2,"Nhà hàng Le Bon và D’Ruby Sky Lounge & Pool Bar sở hữu menu ẩm thực, thức uống đa dạng"
170,3,"Phòng hội họp trang bị đầy đủ thiết bị âm thanh, ánh sáng"
170,4,"Dịch vụ tiện ích khác: Spa, phòng tập Gym,..."
171,1,"Vị trí: tọa lạc tại trung tâm thành phố, thuận tiện di chuyển đến các địa điểm vui chơi, tham quan"
171,2,Hồ bơi ngoài trời với làn nước trong xanh và không gian riêng tư
171,3,"Hệ thống nhà hàng và bar có thiết kế sang trọng, phục vụ ẩm thực đa dạng: Nhà hàng Hoa FengHuan, Nhà hàng La Maison, Sol Skybar & Lounge, The Books Garden Cafe"
171,4,Phòng hội họp trang bị đầy đủ tiện nghi
171,5,"Tiện ích khác: La Pensée Spa, phòng Gym."
172,1,"Tất cả các phòng đều có ban công và bồn tắm, phòng đẹp, hiện đại theo đúng tiêu chuẩn khách sạn 4 sao đặc biệt  tivi có thể kết nối  Netflix; chăn ga gối nệm theo tiêu chuẩn Hàn Quốc, thiết bị vệ sinh phòng tắm tiêu chuẩn Châu Âu;"
172,2,"Một Khách sạn & Spa thân thiện với môi trường cung cấp cho khách các lớp thể dục, cũng như quyền lui tới khu vực chăm sóc sức khỏe và phòng chờ spa."
172,3,"Little Gem – An Eco Friendly Boutique Hotel Hoi An tự hào với tiêu chí thân thiện với môi trường, Nói KHÔNG với các chế phẩm nhựa sử dụng một lần"
172,4,Mục tiêu của Little Gem là trở thành khách sạn  Xanh theo concept thân thiện với môi trường nhưng vẫn đem lại sự sang trọng và thoải mái nhất cho khách hàng.
173,1,"Toạ lạc tại trung tâm thành phố - con phố Đào Duy Từ, chỉ cách phố cổ 4 phút đi bộ, La Charm Hoi An sẽ là điểm dừng chân lý tưởng cho quý khách với"
173,2,"Nằm ở vị trí trung tâm thành phố Hội An, La Charm Hoi An Hotel and Spa là điểm đến lý tưởng để khám phá những nét đẹp văn hóa và lịch sử của địa phương."
173,3,"Với cơ cấu 70 phòng cùng với trang thiết bị hiện đại, LA CHARM HOI AN HOTEL $ SPA sẽ đáp lại những mong muốn của du khách với một chỗ nghỉ thoải mái chỉ cách phố cổ Hội An vài phút đi bộ"
173,4,"Tất cả các phòng đều có ban công, thoáng mát, đón ánh sáng mặt trời tự nhiên , nhưng vẫn đảm bảo sự riêng tư đầy đủ cho một kỳ nghỉ tuyệt vời."
174,1,"Vị trí thuận tiện cho khách du lịch đến các địa điểm vui chơi giải trí nổi tiếng như: Làng cổ Phú Vinh, vịnh Ninh Vân, bãi Tranh,..."
174,2,"Bể bơi trong nhà với không gian thoáng mát, rộng rãi"
174,3,Thưởng thức ẩm thực 3 miền độc đáo tại nhà hàng Lucky Sun của khách sạn.
174,4,Phòng hội nghị hội thảo với sức chứa 50 người
174,5,"Tiện nghi hấp dẫn khác: Trung tâm thể thao, dịch vụ đưa đón sân bay, bãi đỗ xe miễn phí,..."
175,1,Có hồ bơi ngoài trời và bãi biển riêng.
175,2,Nhà hàng nằm ngay trên bãi biển phục vụ các món ăn phương Tây và châu Á.
175,3,"Tham gia các tiện ích giải trí khác như : Minibar, Câu cá, Spa, Massage, Sân chơi trẻ em, Lặn, Cano,..."
176,1,Hồ bơi ngoài trời với không gian rộng rãi
176,2,Hệ thống nhà hàng Phú Vân và quầy bar nằm ở tầng 3 nhìn ra biển
176,3,"Tiện ích khác: Spa, phòng tắm hơi, sân golf ( tại chỗ ),...."
177,1,"Vị trí thuận lợi, dễ dàng di chuyển đến nhiều điểm du lịch nổi tiếng: Central Park(500 m), Tram Huong Tower(700 m),..."
177,2,Hồ bơi vô cực nằm trên tầng 22 của khách sạn với hướng nhìn ra toàn thành phố.
177,3,Hệ thống nhà hàng và quầy bar phục vụ ẩm thực địa phương cùng ẩm thực Châu Âu độc đáo và đa dạng các loại nước uống.
177,4,Phòng hội họp với sức chứa 160 người và đầy đủ các tiện nghi.
177,5,"Dịch vụ khác: phòng Spa, phòng Gym, dịch vụ đổi tiền tệ,..."
178,1,"Hồ bơi vô cực trên tầng thượng tầm nhìn tuyệt đẹp ra bán đảo Sơn Trà, bãi biển Mỹ Khê, biển Đông"
178,2,"Hệ thống nhà hàng, quầy cà phê và quầy bar đa dạng"
178,3,"Phòng hội nghị có sức chứa lên tới 200 người, đầy đủ âm thanh ánh sáng hiện đại"
178,4,"Dịch vụ tiện ích khác: Dịch vụ Shuttle Bus đưa đón khách tại sân bay, Dịch vụ chăm sóc sức khỏe Azure Spa & Massage, phòng tập Gym,.."
179,1,Hồ bơi ngoài trời với tầm nhìn bao quát toàn thành phố
179,2,"Nhà hàng phục vụ thực đơn đa dạng: các món ăn đặc sản Quy Nhơn, ẩm thực Việt Nam truyền thống"
179,3,"Tiện ích khác: dịch vụ Lễ tân 24 giờ, dọn phòng mỗi ngày."
180,1,Sở hữu bãi biển riêng và bể bơi ngoài trời diện tích rộng
180,2,"Hệ thống nhà hàng & Bar: Garden Court, Prime Bar & Grill, Beach House, Achovy, Pool Bar, Patio Lounge."
180,3,"Tiện ích khác: dịch vụ Spa, phòng tập Gym,..."
181,1,Hồ bơi rộng rãi được đặt vị trí trung tâm khách sạn
181,2,Nhà hàng đa dạng ẩm thực Á-Âu đáp ứng mọi nhu cầu du khách
181,3,"Phòng hội họp với sức chứa hơn 200 người với hệ thống âm thanh ,ánh sáng hiện đại"
181,4,"Các dịch vụ tiện ích khác: Spa ,Massage, Mini Bar, GYM, ..."
182,1,Hồ bơi ngoài trời với diện tích lớn bên trong khuôn viên khách sạn
182,2,Nhà hàng phục vụ các món Á - Âu có không gian mở
182,3,"Một số tiện ích khác: Wifi, bãi đậu xe, nhà hàng, quầy bar trong khuân viên,..."
183,1,Bể bơi ngoài trời và bể sục jacuzzi
183,2,Hệ thống nhà hàng mang đến nền ẩm thực đa dạng
183,3,Hệ thống phòng tổ chức sự kiện với sức chứa lớn
183,4,"Các tiện ích khác: phòng tập gym, massage & spa,..."
184,1,Bể bơi ngoài trời nằm giữa rừng nhiệt đới nguyên sinh tạo nên một bầu không khí thanh bình và thư giãn.
184,2,"Hệ thống nhà hàng & bar sang trọng nhưng không kém phần ấm cúng, phục vụ nhiều món ăn độc đáo"
184,3,"Những tiện ích khác: Spa, phòng gym, hoạt động giải trí trên biển,..."
185,1,Bể bơi ngoài trời với tầm nhìn bao quát toàn thành phố
185,2,"Nhà hàng, quán cafe phục vụ thực đơn đa dạng, hấp dẫn"
185,3,"Phòng họp, tổ chức sự kiện Grand Ballroom với trang thiết bị hiện đại, tiên tiến nhất"
185,4,"Tiện ích khác: đưa đón sân bay, lễ tân 24 giờ, dọn phòng hàng ngày."
186,1,Nằm ở gần bãi biển Quy Nhơn xinh đẹp
186,2,Bể bơi ngoài trời với thiết kế độc đáo
186,3,Thưởng thức ẩm thực đa dạng tại hệ thống nhà hàng và bar sang trọng
186,4,Hệ thống phòng hội họp với sức chứa cực lớn
186,5,"Các tiện ích khác: phòng gym, phòng spa, dịch vụ giặt là,..."
187,1,Nằm ở gần bãi biển Quy Nhơn xinh đẹp
187,2,Bể bơi ngoài trời với thiết kế độc đáo
187,3,"Các tiện ích khác: phòng gym, phòng spa, dịch vụ giặt là,..."
188,1,Vị trí gần nhiều địa điểm nổi tiếng
188,2,Nhà hàng mang đến nền ẩm thực Á - Âu đa dạng
188,3,"Các tiện ích khác: phòng hội thảo, dịch vụ massage spa cùng hệ thống bể sục, bể ngâm/ jacuzzi, thảo dược, bấm huyệt, massage Nhật, hồ bơi dành cho trẻ em, tổ chức sự kiện, rạp chiếu phim ngoài trời, yoga bình minh.ện ích khác:"
189,1,"Không chỉ đơn thuần là nơi nghĩ dưỡng, Malibu còn là nơi khởi đầu của sự thăng hoa và kết nố"
189,2,"Malibu có tổng cộng 204 phòng được bài trí trang nhã với thiết kế đẹp mắt và được trang bị vô số tiện nghi. Từ tầng thứ 6 trở lên, bạn sẽ được trải nghiệm các không gian thoáng đãng cùng với quan cảnh biển đẹp mê hồn và lãng mạn hoặc có thể ngắm nhìn thành phố nhộn nhịp sôi động"
189,3,"Dành cho những du khách muốn du lịch thoải mái cùng ngân sách tiết kiệm, The Malibu Hotel sẽ là lựa chọn lưu trú hoàn hảo, nơi cung cấp các tiện nghi chất lượng và dịch vụ tuyệt vời."
189,4,"Từ sự kiện doanh nghiệp đến họp mặt công ty, The Malibu Hotel cung cấp đầy đủ các dịch vụ và tiện nghi đáp ứng mọi nhu cầu của quý khách và đồng nghiệp."
190,1,"Khách sạn cao cấp với nhiều sự lựa chọn về các hạng phòng, cùng tầm nhìn ấn tượng hướng biển hoặc thành phố."
190,2,"Tại Pullman Vũng Tàu, có đa dạng sự lựa chọn về địa điểm tổ chức tiệc bao gồm tòa hội nghị rộng lớn, khu sân vườn với đài phun nước thoáng đãng, hồ bơi tầng cao và các phòng tiệc hiện đại"
190,3,"Phòng lưu trú rộng rãi, thân thiện với gia đình và những tiện ích trong khuôn viên của Pullman Vũng Tàu sẽ là một lựa chọn hoàn hảo cho kỳ nghỉ tiếp theo của bạn và những người thân yêu."
190,4,"Cơ sở vật chất hiện đại, không gian tổ chức linh hoạt và đội ngũ sự kiện chuyên nghiệp, Pullman Vũng Tàu là sự lựa chọn hoàn hảo để tổ chức các buổi hội họp doanh nghiệp."
191,1,Một môi trường sống đẳng cấp chỉ dành riêng cho giới thượng lưu đang được hình thành từng ngày tại thành phố Vũng Tàu. OYSTER BAY VŨNG TÀU hội tụ tất cả những tiêu chuẩn về một trải nghiệm sống hoàn hảo mà bất cứ ai cũng ao ước sở hữu.
191,2,"Khách sạn với kiến trúc tân cổ điển mang đậm hơi thở Châu Âu hiện đại cùng hai tòa tháp vươn mình kiêu hãnh giữa một vùng biển xanh ngát. Trước mặt là bờ biển trải dài, nơi hội tụ sinh khí của đất trời, mang đến nguồn tài lộc dồi dào và sự bình yên cho du khách đến nghỉ dưỡng."
191,3,"Trải nghiệm nghỉ dưỡng tại Khách sạn, du khách hoàn toàn có thể thưởng thức trọn vẹn khoảnh khắc của bình minh trong vắt hay hoàng hôn cùng những tia nắng vàng cam mỏng tan còn sót lại, tận hưởng phút giây nghỉ ngơi, thư giãn hưởng thụ với rất nhiều tiện ích."
192,1,"Fusion Suites Vũng Tàu là lựa chọn tuyệt vời cho quý khách với phòng chức năng rộng lớn, được trang bị đầy đủ để sẵn sàng đáp ứng mọi yêu cầu."
192,2,Khách sạn này là lựa chọn hoàn hảo cho các kỳ nghỉ mát lãng mạn hay tuần trăng mật của các cặp đôi. Quý khách hãy tận hưởng những đêm đáng nhớ nhất cùng người thương của mình tại Fusion Suites Vũng Tàu
192,3,"Hầu hết các căn hộ và phòng khách sạn có tầm nhìn hướng biển, được thiết kế nhằm mang đến sự thư giãn tối đa và phong cách sống khỏe mạnh, hạnh phúc. Kiến trúc bên ngoài và thiết kế nội thất đều lấy ý tưởng từ những sắc màu và phong vị biển, mang đến cho du khách một không gian thân thiện, hiền hòa xanh mát."
192,4,"Các tầng đều có bể bơi tràn bờ hướng biển, mang đến cảm giác được hòa mình vào biển xanh ngay trong lòng khách sạn. Tất cả tạo nên dấu ấn riêng, mang đến những trải nghiệm tuyệt vời đối với mỗi du khách."
193,1,Nằm gần rất nhiều bãi biển nổi tiếng của Vũng Tàu
193,2,Hồ bơi ngoài trời cực kì thoáng mát
193,3,Nhà hàng phục vụ các bữa ăn kiểu lục địa
193,4,Phòng họp hội nghị với sức chứa lớn
193,5,"Các tiện ích khác: phòng gym, spa, kids club,..."
194,1,Hồ bơi vô cực được thiết kế độc đáo tại tầng 4 của khách sạn.
194,2,Hệ thống nhà hàng và quầy bar phục vụ đa dạng món ăn
194,3,Phòng hội nghị của khách sạn có diện tích 82m sức chứa khoảng 80 khách.
194,4,"Các tiện ích khác: dịch vụ spa, massage,..."
195,1,"Hồ bơi nước mặn và hồ bơi nước ngọt vô cực ngoài trời, có khu vực hồ bơi dành cho trẻ em."
195,2,"Hệ thống nhà hàng và quán bar phục vụ ẩm thực Việt - Ý, bao gồm: Nhà hàng hải sản Ocean Bay, Nhà hàng SOI, Infinity Lounge Bar & Coffee và Nhà hàng Ý Il Mare."
