hotel_id,block_id,data
1,1,"Với tông màu chủ đạo vàng, trắng sử dụng trong thiết kế nội thất phòng được lấy cảm hứng từ màu của loại đá quý – Đá Hổ Phách, khách sạn mang đến nguồn năng lượng tích cực, tưởi mới đồng thời cũng tượng trưng cho sự ấm áp và chân thành"
1,2,"Hệ thống phòng họp và hội nghị được trang bị máy chiếu, âm thanh cùng những trang thiết bị hiện đại"
1,3,Tổ hợp giải trí- sức khoẻ tại khách sạn sẽ làm hài lòng những vị khách khó tính nhất khi sử dụng dịch vụ tại đây
1,4,"Thưởng thức những ly cooktail nhiệt đới đầy màu sắc và  món ăn ngon từ các nền văn hoá ẩm thực phong phú Âu, Á"
2,1,"Sở hữu vị trí trung tâm và tọa lạc ngay gần con đường đi bộ uốn lượn cạnh bờ biển của thành phố trong lành nhất Việt Nam, đây là căn hộ khách sạn hoàn hảo để bạn thỏa sức khám phá địa danh Di sản Thế giới đã được UNESCO công nhận."
2,2,"Tọa lạc ngay tại ví trí trung tâm, Citadines Marina Halong khiến việc khám phá thành phố biển này dễ dàng hơn bao giờ hết khi cảnh quan hàng ngàn năm tuổi đang chờ du khách tới thăm ngay ngoài ngưỡng cửa"
2,3,Citadines Marina Halong mang đến cho bạn sự linh hoạt trong sử dụng dịch vụ với đa dạng các hạng phòng từ studio được trang bị và thiết kế đẹp mắt đến các căn hộ 2 phòng ngủ và 3 phòng ngủ
3,1,"Tại Sea Stars, chúng tôi cung cấp đầy đủ những tiện ích đẳng cấp đạt tiêu chuẩn 5 sao quốc tế, từ spa, bể bơi hay trung tâm chăm sóc sức khỏe, nơi quý khách có thể tận hưởng những phương pháp làm đẹp, tái tạo năng lượng sau một hành trình dài."
3,2,"Đối với những vị khách có gu ẩm thực thời thượng, không gian nhà hàng và các quán bar sang trọng tại Sea Stars với đa dạng phong cách phục vụ, cùng thực đơn đặc sắc, chắc chắn sẽ chiều lòng vị giác của bất kì thượng khách nào ghé qua."
3,3,"Đồng hành cùng bạn trong chuyến hành trình nghỉ dưỡng lý tưởng với hệ thống bể bơi công nghệ cao và câu lạc bộ sức khỏe hiện đại, chúng tôi cam kết mang đến cho bạn những trải nghiệm dịch vụ ấn tượng và đáng nhớ. Hãy đến và tận hưởng kỳ nghỉ trong mơ tại khách sạn Sea Stars Hạ Long"
4,1,"Nhà hàng Blue Bay không chỉ nổi bật với thực đơn đa dạng, mà còn ấn tượng bởi việc trang bị bếp mở. Thực khách sẽ được nhìn thấy những bước chế biến thức ăn trực tiếp, tạo ra một trải nghiệm ẩm thực độc đáo và gần gũi hơn"
4,2,"Tại Wyndham Legend Halong, khách sạn truyền cảm hứng cho sự kiện và khách mời của bạn, với sự hỗ trợ đặc biệt bởi các ứng dụng công nghệ cao cùng đội ngũ nhân viên chuyên nghiệp."
4,3,"Khách sạn Wyndham Legend Halong không chỉ có chuỗi phòng nghỉ cao cấp, hiện đại, sang trong, nơi tổ chức tiệc cưới thời thượng, khu vui chơi lành mạnh, an toàn cho trẻ em...mà còn có phòng tập hiện đại, tối tân cho dân thể"
5,1,"Các phòng nghỉ với phong cách thiết kế mới mẻ, thoáng mát, hiện đại rất phù hợp cho du khách khi nghỉ dưỡng tại khách sạn"
5,2,"không gian các phòng hội nghị hội thảo từ nhỏ tới lớn, các nhà hàng với phong cách ẩm thực đa dạng, dịch vụ chuyên nghiệp, bể bơi, phòng tập GYM, khu Spa & Massage cùng các trang thiết bị hiện đại đẳng cấp sẽ đáp ứng mọi nhu cầu của du khách"
6,1,"D’Lecia Hạ Long làm điểm dừng chân, du khách sẽ được thư giãn thoải mái, với nhiều hạng phòng và dịch vụ đi kèm phù hợp cho các nhu cầu khác nhau của khách."
6,2,"Mỗi căn phòng đều theo lối thiết kế hiện đại, kết hợp cùng những tông màu đặc trưng của khách sạn, tất cả tạo nên sự hài hòa với cảnh quan nơi đây. Bên cạnh đó, các phòng đều được trang bị cơ sở vật chất gồm những thiết bị và phương tiện hiện đại như ti vi thông minh, két sắt, minibar,…"
6,3,"Các dịch vụ còn bao gồm dịch vụ đưa đón sân bay và cho thuê xe điện, đảm bảo luôn sẵn sàng phục vụ chuyến đi của quý khách."
7,1,Grand Fleuve Boutique Hotel là lựa chọn sáng giá dành cho những ai đang tìm kiếm một trải nghiệm xa hoa đầy thú vị trong kỳ nghỉ của mình. Lưu trú tại đây cũng là cách để quý khách chiều chuộng bản thân với những dịch vụ xuất sắc nhất và khiến kỳ nghỉ của mình trở nên thật đáng nhớ.
7,2,Dịch vụ thượng hạng song hành với hàng loạt tiện nghi phong phú sẽ đem đến cho quý khách trải nghiệm của một kỳ nghỉ viên mãn nhất.
7,3,"Từ sự kiện doanh nghiệp đến họp mặt công ty, Grand Fleuve Boutique Hotel cung cấp đầy đủ các dịch vụ và tiện nghi đáp ứng mọi nhu cầu của quý khách và đồng nghiệp"
7,4,Trung tâm thể dục của khách sạn là một trong những tiện nghi không thể bỏ qua khi lưu trú tại đây.
8,1,Vị trí ở gần trung tâm và biển
8,2,Hồ bơi ngoài trời với tầm nhìn bao trọn cảnh biển
8,3,Nhà hàng phục vụ thực đơn đa dạng
8,4,"Tiện ích khác: dịch vụ Spa, phòng Gym,..."
9,1,"Khách sạn Mường Thanh Grand Hạ Long tọa lạc tại vị trí ngày cửa ngõ vào trung tâm du lịch Bãi Cháy. Với chất lượng đạt chuẩn 4 sao, có kiến trúc độc đáo quy mô lên tới192 phòng nghỉ được thiết kế hài hòa với thiên nhiên tạo ra không gian vô cùng thoải mái"
9,2,Khách sạn Mường Thanh Grand Bãi Cháy tọa lạc tại vị trí đắc địa tại thành phố Hạ Long. Từ khách sạn có thể di chuyển thuận tiện và dễ dàng tới các điểm tham quan và công tác trong thành phố.
9,3,"Là khách sạn đạt tiêu chuẩn 4 sao tại thành phố Hạ Long, Mường Thanh Grand Bãi Cháy là sự lựa chọn tuyệt vời cho quý khách tham quan cũng như công tác tại đây"
10,1,"Halong Plaza Hotel nằm ở trung tâm thành phố Hạ Long, cách Ga cáp treo Nữ Hoàng 800 m. Khách sạn có hồ bơi ngoài trời, trung tâm thể dục và nhà hàng cũng như chỗ đỗ xe riêng miễn phí trong khuôn viên."
10,2,"Tất cả các phòng nghỉ sang trọng tại đây được trang bị đầy đủ tiện nghi, bao gồm máy điều hòa, Wi-Fi miễn phí, đồ nội thất hiện đại, cửa sổ lớn đón nhiều ánh sáng tự nhiên và nhìn ra biển, TV truyền hình vệ tinh màn hình phẳng, tủ lạnh mini và tủ quần áo"
10,3,Du khách có thể thư giãn với buổi xông hơi khô hoặc tận hưởng liệu pháp mát-xa nhẹ nhàng. Khách sạn còn có trung tâm dịch vụ doanh nhân đầy đủ trang thiết bị với dịch vụ fax và photocopy.
11,1,"Royal Khanh Hotel tọa lạc trên đường Nguyễn Huệ, ngay Trung tâm thành phố Phú Yên - Tuy Hòa, nằm gần biển với bãi biển sạch đẹp, thoáng mát, giao thông đi lại rất thuận tiện"
11,2,Nhà hàng của khách sạn nằm ở tầng 1 và tầng 7 với không gian thoáng đãng và cách bài trí ấm cúng có thể phục vụ cùng lúc 40 đến 200 thực khách với ẩm thực Á - Âu phong phú.
11,3,"Đội ngũ cán bộ nhân viên của Khách sạn Royal Khanh luôn được trau dồi về chuyên môn và nghiệp vụ; với tinh thần nhiệt tình, hết lòng vì khách hàng, luôn ân cần và chu đáo sẽ mang đến cho du khách trải nghiệm tại Phú Yên cảm giác thân thiện, ấm cúng như đang được ở chính ngôi nhà của mình."
12,1,"Sài Gòn Phú Yên Hotel là khách sạn 4 sao, thuộc hệ thống Saigontourist, tọa lạc tại trung tâm thành phố Tuy Hòa, nơi yêu thích nhất của du khách thập phương khi ghé thăm thành phố biển Tuy Hòa xinh đẹp."
12,2,"Khách sạn có các phòng họp lớn, nhỏ với sức chứa từ 30 – 300 khách được trang bị đầy đủ tiện nghi cùng với phong cách phục vụ chuyên nghiệp."
12,3,"Khách sạn có nhà hàng chuyên phục vụ các món ăn Âu, Á,… Đây là một trong những lựa chọn phù hợp để tổ chức những sự kiện, bữa cơm thân mật, những buổi tiệc, liên hoan, sinh nhật trong một không gian kín đáo, sang trọng."
13,1,"Hồ bơi ngoài trời với diện tích lớn, có khu vực riêng cho trẻ em."
13,2,"2 nhà hàng Hoa Hướng Dương và Hoa Hải Đường có sức chứa lớn, vừa phục vụ khách lưu trú vừa cung cấp dịch vụ tổ chức tiệc trọn gói."
13,3,"phòng hội nghị, hội thảo được trang bị hiện đại, có sức chứa từ 150 đến 700 khách."
13,4,"Các tiện ích khác: spa, sân tennis ngoài trời phục vụ 24/24h,..."
14,1,Anya Quy Nhơn Hotel là khách sạn Quy Nhơn 4 sao tiêu chuẩn quốc tế được chính thức đi vào hoạt động từ tháng 10/2023.
15,1,"Nằm ở Hạ Long, cách Bãi biển Marina Bay chưa đến 1 km, Hạ Long New Century Hotel cung cấp chỗ nghỉ có hồ bơi ngoài trời, chỗ đậu xe riêng miễn phí, trung tâm thể dục và phòng chờ chung."
15,2,Khách sạn Hạ Long New Century là sự kết hợp của những công nghệ hiện đại cùng phong cách Việt gần gũi tạo cảm giác thoải mái và thân thiện
15,3,"Nhà hàng sang trọng với sức chứa tối đa khoảng 200 khách, sẵn sàng phục vụ các bữa sáng, trưa, tối và các chương trình gala dinner phục vụ đa dạng các món ăn tinh hoa ẩm thực Việt Nam."
15,4,"Hòa mình trong bầu không khí sôi động tại khu du lịch Bãi Cháy, phù hợp tổ chức các chuỗi hoạt động team building thú vị với đường bờ biển dài tới 2km."
16,1,"Từ khách sạn, du khách có thể dễ dàng di chuyển đến các điểm tham quan nổi tiếng nhất tại Hà Nội chỉ với khoảng cách ngắn nhất"
16,2,"KTừ khách sạn, du khách có thể dễ dàng di chuyển đến các điểm tham quan nổi tiếng nhất tại Hà Nội chỉ với khoảng cách ngắn nhất"
16,3,"Từ khách sạn, du khách có thể dễ dàng di chuyển đến các điểm tham quan nổi tiếng nhất tại Hà Nội chỉ với khoảng cách ngắn nhất"
17,1,"Hanoi Starlight Hotel tọa lạc tại 34 phố Hàng Gà – một trong những con phố cổ đẹp nhất trong lòng Phố Cổ Hà Nội, rất thuận tiện trong việc di chuyển, tham quan các địa điểm nổi tiếng"
17,2,"Khách sạn là sự kết hợp hài hòa kiến trúc cổ điển và hiện đại với tổng cộng 30 phòng nghỉ cùng đội ngũ nhân viên được đào tạo chuyên nghiệp, nhiệt tình mang đến cho Quý khách một kỳ nghỉ nhiều trải nghiệm tuyệt vời."
17,3,"Nội thất được bày trí khoa học, decor tối giản nhưng rất ấn tượng, màu chủ đạo đen trắng kết hợp với ánh sáng vàng tạo cảm giác thân thiện, ấn cúng như nhà mình"
18,1,"Khách sạn Affa Boutique Hà Nội tọa lạc tại một trong những con phố sầm uất nhất của phố cổ Hà Nội, nơi luôn được các khách du lịch và cả những người dân yêu quý ghé thăm với những nét văn hóa đặc trưng của Hà Thành."
18,2,"Khách sạn Affa Boutique Hà Nội mang tới một không gian nhẹ nhàng, cổ điển, thanh lịch xen kẽ trong dòng chảy sôi động của thành phố, là một không gian mà bạn có thể dừng lại để yên tĩnh nghỉ dưỡng, thư giãn và ngắm nhìn thành phố tuyệt đẹp này."
18,3,"Không chỉ là điểm dừng chân, Affa Boutique Hotel còn là nơi kết nối những khoảnh khắc ý nghĩa cùng gia đình và bạn bè, giúp chuyến đi của bạn thêm trọn vẹn và đáng nhớ."
19,1,"Khách sạn Ancient Paradise Hà Nội tọa lạc tại trung tâm phố cổ Hà Nội, có dịch vụ nhận phòng/trả phòng cấp tốc, phòng nghỉ tiện nghi sạch sẽ, nhà hàng,"
19,2,"Khách sạn Ancient Paradise tọa lạc gần nhiều nhà hàng nổi tiếng, đảm bảo mang đến cho du khách những trải nghiệm ẩm thực tuyệt vời."
19,3,"Khách sạn Ancient Paradise nằm gần nhiều điểm mua sắm phổ biến như Vietcraft, Hương Sen, Nhà may Nam, Chie Design và Yến Boutique"
19,4,Khách sạn Ancient Paradise là một điểm đến lý tưởng cho du khách muốn khám phá Hà Nội và thư giãn trong một không gian tiện nghi và thoải mái.
20,1,Khám phá các dịch vụ của khách sạn Melia Hà Nội và trải nghiệm đẳng cấp đỉnh cao.
20,2,Khách sạn chăm chút từng chi tiết cho kỳ nghỉ của bạn để đảm mỗi khoảnh khắc tại Việt Nam đều trọn vẹn.
20,3,"Lưu trú trong căn phòng với những tiện nghi tốt nhất, nhiều dịch vụ cá nhân hóa, đặc quyền riêng và quyền lui tới các khu vực VIP của khách sạn"
20,4,"Trải nghiệm sự kết hợp hoàn hảo giữa thiết kế, tiện nghi và sang trọng trong thời gian lưu trú tại Hà Nộ"
21,1,Khách sạn kết hợp giữa thiết kế cổ điển và tiện nghi hiện đại tạo nên một không gian lưu trú lý tưởng.
21,2,"Không chỉ sở hữu vị trí giúp quý khách dễ dàng ghé thăm những địa điểm lý thú trong chuyến hành trình, H Hotel Ha Noi cũng sẽ mang đến cho quý khách trải nghiệm lưu trú mỹ mãn."
21,3,"Tọa lạc gần sân bay, H Hotel Ha Noi là nơi nghỉ ngơi lý tưởng trong lúc quý khách đang chờ chuyến bay kế tiếp. Quý khách có thể tận hưởng không gian nghỉ dưỡng vừa ý nơi đây trong quá trình quá cảnh."
23,1,Nằm ở trung tâm thành phố thuận lợi cho việc di chuyển
23,2,Hồ bơi vô cực có tầm nhìn đẹp và có quầy bar bên hồ
23,3,"Hai nhà hàng ATHENA và CRONUS cung cấp món ăn đa dạng, phong phú cho khách lưu trú"
23,4,Phòng hội nghị hiện đại với sức chứa lớn
23,5,"Nhiều tiện ích hấp dẫn: spa, gym,...."
24,1,"Vị trí ở gần trung tâm, gần biển"
24,2,Hồ bơi vô cực có tầm nhìn đẹp
24,3,Phòng hội nghị hiện đại với sức chứa lớn
24,4,"Nhiều tiện ích hấp dẫn: spa, gym,...."
25,1,"Khách sạn Sala Tuy Hòa (Sala Tuy Hoa Beach Hotel) tọa lạc giữa trung tâm thành phố Tuy Hòa, tỉnh Phú Yên, cách sân bay Tuy Hòa khoảng 8.4 km và cách nhà ga Tuy Hòa khoảng 2.9 km."
25,2,"Với không gian đa dạng cả trong và ngoài, khách sạn có thể tổ chức nhiều loại hình sự kiện, tiệc cưới, tiệc công ty, các hoạt động teambuilding ngoài trời,…"
25,3,Nhà hàng tại sân vườn Sala Tuy Hoa Beach là nơi du khách có thể thưởng thức buffet sáng sang trọng với những món ăn tuyệt ngon để có thể bắt đầu một ngày mới tràn đầy năng lượng.
26,1,Grand Tourane Hotel Da Nang có vị trí tuyệt đẹp trên bãi biển Mỹ Khê Đà Nẵng
26,2,Bể bơi ngoài trời với diện tích rộng lớn nhìn thẳng ra biển Mỹ Khê
26,3,"Số lượng phòng lớn phù hợp với nhiều yêu cầu khác nhau của du khách từ nghỉ ngơi đến hội nghị, hội thảo"
27,1,"Tọa lạc trên đại lộ Hùng Vương - ngay công viên trung tâm, Phú Yên Everyday Hotel cung cấp chỗ nghỉ hiện đại ở thành phố Tuy Hòa và có nhiều nhà hàng, hồ bơi, trung tâm thể dục cùng chỗ đỗ xe miễn phí trong khuôn viên."
27,2,"Khách sạn có nhà hàng Ocean Beach Restaurant với 200 - 250 chỗ ngồi là một trong những lựa chọn phù hợp để tổ chức những sự kiện, bữa cơm thân mật, những buổi tiệc, liên hoan, sinh nhật… trong một không gian kín đáo, sang trọng cùng với đội ngũ đầu bếp chuyên nghiệp có thể chế biến được nhiều món Âu Á đáp ứng được sự hài lòng của nhiều du khách khi đến với Khách sạn."
27,3,"Phú Yên EveryDay Hotel có hồ bơi vô cực tuyệt đẹp để du khách có thể tận hưởng không khí trong lành, thả mình trên giường phơi nắng sang trọng hoặc thưởng thức đồ uống với cocktail đặc trưng ngon nhất của quầy bar bên hồ bơi."
28,1,"Khách sạn Hùng Vương Tuy Hoà tọa lạc trên đường Hùng Vương, gần trung tâm thành phố Tuy Hòa, chỉ cách bờ biển vài phút đi bộ, cách ga Tuy Hòa khoảng 3 km và cách sân bay Tuy Hòa khoảng 9 km."
28,2,"Khách sạn bao gồm các dịch vụ tiện ích như: hồ bơi ngoài trời, dịch vụ massage, bàn đặt tour, wifi công cộng, nhà hàng, quán cà phê, quầy bar."
28,3,"Từ khách sạn, du khách có thể dễ dàng di chuyển tới các điểm tham quan thú vị như đình Hồ Sơn Cổ Tự, bảo tàng Phú Yên..."
29,1,Gần các địa điểm thu hút và lựa chọn ăn uống thú vị
29,2,Hồ bơi rộng rãi được đặt ở vị trí trung tâm của khách sạn
29,3,Nhà hàng phục vụ món ăn đa dạng ẩm thực Á-Âu
29,4,"Tiện ích khác: Đưa đón sân bay, phục vụ phòng 24/24, ..."
30,1,Tọa lạc gần trục đường chính Trần Phú với nhiều trung tâm giải trí và mua sắm
30,2,Bể bơi ngoài trời tầng 22 với tầm nhìn ra biển
30,3,Thưởng thức ẩm thực hảo hạng tại nhà hàng Aaron
30,4,"Các dịch vụ tiện ích khác: phòng thể dục,..."
31,1,Vị trí đắc địa gần biển ở Vịnh biển Nha Trang
31,2,"Hồ bơi tầng 7 xanh mát, sky bar phục vụ đồ uống đa dạng, thượng hạng"
31,3,"Nhà hàng REDSUN phục vụ các món ăn đặc sắc, menu Âu, Á, A la carte đa dạng."
31,4,"Các dịch vụ khác: phòng họp, spa, phòng tập thể dục,..."
32,1,Khách sạn 5 sao với những dịch vụ nghỉ dưỡng sang trọng và đẳng cấp
32,2,"Hệ thống phòng nghỉ hiện đại và rộng rãi với tầm nhìn tuyệt đẹp ra dòng sông thơ mộng, đường chân trời với những tòa nhà hiện đại hay vịnh Đà Nẵng."
32,3,Sỡ hữu hồ bơi vô cực dát vàng 24K cao nhất và lớn nhất thế giới cùng tầm nhìn toàn cảnh ra thành phố Đà Nẵng xinh đẹp
33,1,"Khách sạn Mường Thanh Luxury Đà Nẵng nằm bên bờ biển Mỹ Khê xinh đẹp, sẽ mang đến cho du khách một không gian sang trọng, quý phái khi đển thăm thành phố Đà Nẵng."
33,2,"Du khách chỉ cần đi bộ vài bước chân là có thể đến bãi biển Mỹ Khê. Khoảng cách đến sân bay Đà Nẵng khoảng 5,5 km, ga Đà Nẵng 5 km."
33,3,Địa điểm lưu trú thuận lợi giúp du khách dễ dàng di chuyển trong những địa điểm tham quan nổi tiếng của thành phố
34,1,Khách sạn tọa lạc trên cung đường biển Võ Nguyên Giáp - Đà Nẵng
34,2,Thiết kế hiện đại đầy đủ các trang thiết bị phòng nghỉ
34,3,Bể bơi ngoài trời tại tầng thượng giúp du khách có giây phút tự do và thoải mái nhất
35,1,Khách Sạn The LEAF Boutique nằm tại bãi biển Mân Thái ngay bên cạnh bãi biển Mỹ Khê xinh đẹp
35,2,"The LEAF Boutique cung cấp chỗ nghỉ với hồ bơi ngoài trời, chỗ đỗ xe riêng miễn phí, quầy bar và sảnh khách chung"
35,3,"Với thiết kế thanh lịch và gần gũi, sang trọng, tất cả phòng của khách hàng đều có trang bị tiện nghi chu đáo"
36,1,"Với nội thất tinh tế, sàn gỗ ấm cúng, giường ngủ êm ái, bồn tắm sang trọng cùng ban công hướng biển, tất cả đem đến một trải nghiệm trọn vẹn và ấn tượng."
36,2,"Thưởng thức  những món ăn bản địa độc đáo  đến ẩm thực quốc tế đặc sắc, từ bộ sưu tập bánh ngọt phong phú đến các thức uống bổ dưỡng, ngon miệng và cocktail sáng tạo"
36,3,Với hệ thống Spa- vui chơi - giải trí -  Khách sạn hứa hẹn là nơi giao thoa giữa tận hưởng dịch vụ khách sạn chuẩn 5 sao đẳng cấp quốc tế và trải nghiệm văn hóa bản địa theo cách độc đáo và mới mẻ nhất.
37,1,Tọa lạc tại cung đường biển đẹp nhất Nha Trang
37,2,Hồ bơi ngoài trời nằm ở tầng 4 của khách sạn với tầm nhìn ra vịnh Nha Trang xinh đẹp.
37,3,"rải nghiệm ẩm thực tươi ngon và đa dạng của vùng nhiệt đới tại hệ thống nhà hàng và bar: Nhà hàng Tulip, Nhà hàng Hoa Hồng, Camellia Bar, Daisy Pool Bar và Moonlight Café."
37,4,"Với công suất khoảng 400 khách, khách sạn Horizon là địa điểm lý tưởng để tổ chức nhiều sự kiện lớn, nhỏ."
37,5,"Các dịch vụ khác: Du thuyền Horizon, câu lạc bộ trẻ em, karaoke, spa,..."
38,1,Hilton Garden Inn Đà Nẵng là khách sạn chất lượng 4 sao chỉ cách bãi biển Mỹ Khê vài bước chân
38,2,"Khách sạn có bể bơi ngoài trời, nhà hàng và spa với các phương pháp trị liệu hiệu quả"
38,3,Tất cả các phòng đều được thiết kế đầy đủ nội thất hiện đại cùng các thiết bị chất lượng
39,1,Vị trí đắc địa chỉ cách bãi biển Tuy Hoà 10 phút đi bộ
39,2,Hồ bơi vô cực trên tầng thượng của khách sạn với tầm nhìn ra biển vô cùng tuyệt vời
39,3,Nhà hàng với sức chứ lớn lên đến 200 người phục vụ thực đơn đa dạng từ các món ăn truyền thống Việt Nam đến các món ăn ẩm thực Châu Âu
39,4,Quầy bar bên hồ bơi với thực đơn đa dạng và phong phú
39,5,Tiện nghi hội họp với đầy đủ các chức năng
39,6,"Dịch vụ tiện ích khác như: dịch vụ spa, phòng gym, bãi đậu xe, đưa đón sân bay,..."
40,1,"Khách sạn với đầy đủ các trang thiết bị nội thất đẹp mắt, hiện đại và trang nhã"
40,2,Bể bơi ngoài trời trên tầng thượng khách sạn có tầm nhìn toàn cảnh biển Đà Nẵng xinh đẹp
40,3,"Trung tâm Spa, phòng xông hơi khô, bể sục là nơi du khách có thể thư giãn với những liệu pháp massage chuyên nghiệp"
40,4,"Vị trí thuận lợi gần Cầu Sông Hàn, Chợ Hàn và Chùa Linh Ứng giúp du khách dễ dàng di chuyển."
41,1,Tọa lạc ngày gần trung tâm thành phố Tuy Hòa
41,2,"Hệ thống nhà hàng mang đến nền ẩm thực đa dạng, phòng tiệc và tổ chức sự kiện với sức chứa lớn"
41,3,"Các tiệc ích khác: phòng spa, khu vui chơi cho trẻ em,..."
42,1,Royal Lotus Hotel Danang là khách sạn 4 sao quốc tế tọa lạc trên tuyến đường Nguyễn Văn Thoại sầm uất của thành phố biển Đà Nẵng
42,2,"Kiến trúc hiện đại cùng loạt tiện ích cao cấp, khách sạn cam kết sẽ mang tới cho quý khách những khoảnh khắc nghỉ dưỡng đầy ấn tượng."
42,3,"Royal Lotus Hotel Danang là điểm đến lý tưởng với tiện nghi giải trí đa dạng như phòng tập gym, spa, bể bơi"
42,4,"Không gian trang trí sang trọng, đầy đủ tiện nghi với dịch vụ hoàn hảo."
43,1,Khách sạn nằm ở vị trí vô cùng thuận lợi chỉ cách bãi biển Mỹ Khê vài phút đi bộ
43,2,Nhà hàng khách sạn phục vụ bữa sáng buffet theo kiểu Á và Âu kết hợp
43,3,Phòng nghỉ đầy đủ các thiết bị hiện đại và tiện ích
43,4,Khách sạn sở hữu quầy bar ấn tượng tại tầng thượng bên cạnh bể bơi ngoài trời
44,1,"Vị trí gần nhiều địa điểm nổi tiêng: Bãi biển Tuy Hòa(850 m), Tháp Nghinh Phong 2km, cách Hồ Điều Hòa Hồ Sơn 1,9km, cách Bãi Rêu Xanh - Xóm Rớ 6,6km, và cách Bãi Xép 13,5km."
44,2,Hai hồ bơi ngoài trời diện tích lớn dành cho mọi độ tuổi
44,3,"Thưởng thức ẩm thực tại: Vegan Rice restaurant, Good Vegan Restaurant,..."
44,4,"Tiện ích khác: Wifi miễn phí, phòng tập thể hình,..."
45,1,"Khách sạn với đầy đủ các tiện ích: phòng nghỉ, nhà hàng, quầy bar"
45,2,Vị trí thuận lợi chỉ cách bãi biển Mỹ Khê khoảng 150m đi bộ
45,3,Nhà hàng với sức chứa hơn 100 khách phục vụ bữa sáng buffet và các bữa theo thực đơn yêu cầu
46,1,"Vị trí gần nhiều điểm đến nổi tiếng: Công viên Thiếu Nhi(800 m), Park(1,9 km), Quy Nhon Beach(450 m)"
46,2,"Bể bơi ngoài trời tại tầng 1, có khu vực dành cho trẻ em."
