hotel_id,block_id,data
46,3,Nhà hàng có sức chứa lên tới 70 khách.
46,4,Dịch vụ massage và trung tâm chăm sóc sức khỏe.
47,1,"Vị thế thuận lợi chỉ cách trung tâm thành phố 2 km, bạn có thể tham quan những điểm du lịch nổi tiếng"
47,2,Hệ thống phòng nghỉ thoải mái được thiết kế hiện đại với đầy đủ các tiện ích
47,3,Du khách sẽ cảm nhận được khung cảnh hùng vĩ của đại dương bất tận trước mắt mình từ quầy bar trên tầng thượng của khách sạn
48,1,"Hồ bơi ngoài trời thiết kế theo phong cách La Mã độc đáo, có khu vực cho trẻ em."
48,2,"Hệ thống nhà hàng - bar: Nhà hàng Hương Việt, Nhà hàng Imperial, Lobby Lounge, Bar hồ bơi, Bar bãi biển, Sky Club."
48,3,2 phòng họp lớn và 1 phòng họp nhỏ với sức chứa lên đến 150 người.
48,4,"Tiện ích khác: phòng tập thể hình, yoga, dịch vụ Spa, ..."
49,1,Khách sạn nằm ở vị trí vô cùng thuận lợi với vài bước chân là du khách có thể ra tới biển Mỹ Khê xinh đẹp
49,2,"Phòng nghỉ của khách sạn được trang bị đầy đủ như ti vi màn hình phằng, bàn làm việc, phòng tắm riêng"
49,3,Bể bơi ngoài trời nằm trên tầng thượng của khách sạn
49,4,Bữa sáng buffet hàng ngày dành cho khách lưu trú tại khách sạn
50,1,Vị trí đắc địa ngay trung tâm thành phố Đà Nẵng
50,2,"Thiết kế hiện đại, sang trọng kết hợp truyền thống và thanh lịch kiểu Pháp"
50,3,Phòng nghỉ sang trọng với đầy đủ tiện nghi cao cấp
50,4,"Khách sạn sở hữu nhà hàng với thực đơn phong cách Á, Âu phù hợp với từng thực khách"
51,1,"Vị trí trung tâm (khu phố Tây), đi bộ tới biển trong vòng 5 phút."
51,2,Hồ bơi vô cực ở tầng thượng.
51,3,Nhà hàng sang trọng phục vụ các món ăn theo thực đơn Á - Âu
51,4,Quầy Bar tầng thượng ngắm nhìn toàn cảnh thành phố
51,5,"Các dịch vụ bổ sung tiện ích: Gym, dịch vụ Spa, Khu vui chơi trẻ em, ..."
52,1,"Vị trí: tọa lạc tại trung tâm thành phố Nha Trang, thuận tiện di chuyển"
52,2,Bể bơi thoáng mát nằm tại tầng 3 của khách sạn
52,3,"Nhà hàng QUI nằm tại tầng trệt, phục vụ những bữa ăn thịnh soạn từ Âu đến Á"
52,4,"Tiện ích khác: Spa/Massage, phòng gym, khu vui chơi trẻ em, phòng chờ dân cư,..."
53,1,"Khách sạn Paris Deli tọa lạc ngay mặt đường Võ Nguyên Giáp, phía trước là biển Mỹ Khê tuyệt đẹp"
53,2,"Khách sạn gồm 23 tầng với hơn 103 phòng ngủ với thiết kế hiện đại, tiện nghi"
53,3,Du khách có thể trải nghiệm không gian thoáng đãng ngoài trời tại SkyLine Bistro and Lounge trên tầng thượng của khách sạn
53,4,Khoảng cách từ khách sạn đến các điểm du lịch nổi tiếng chỉ khoảng tử 5- 10 phút
54,1,Chỉ cách bãi biển 5 phút đi bộ
54,2,Sở hữu bể bơi trong nhà với đầy đủ tiện nghi
54,3,"Nhà hàng Vesna với thực đơn Âu - Á đa dạng, phong phú có sức chứa lên đến 700 khách"
54,4,Sảnh hội nghị diện tích 220m2 với sức chứa lên đến 300 khách
54,5,"Các dịch vụ nổi bật khác: khu vui chơi trẻ em, phòng chăm sóc sức khỏe..."
55,1,"Vị trí đẹp, nằm ngay trung tâm thành phố Nha Trang"
55,2,Có hồ bơi ở tầng 18 kết hợp với với view cực chill
55,3,"Nhà hàng phục vụ đa dạng thực đơn món ăn Âu, Á và các món ăn thuần túy Việt Nam."
55,4,Phòng hội nghị với sức chứa lớn.
55,5,"Có nhiều tiện ích hấp dẫn: gym, yoga, spa & massage..."
56,1,Tọa lạc tại con đường nhộn nhịp nhất ở thành phố Nha Trang.
56,2,Hồ bơi ngoài trời nằm trên tầng 26 của khách sạn có hướng nhìn tuyệt đẹp.
56,3,"Nhà hàng Royal nằm trên tầng 2 của khách sạn, phục vụ những món ăn đẳng cấp đến từ châu Âu, châu Á và các món đặc sản địa phương. Imperial Bar mang đến cho khách những hương vị cocktail mới lạ."
56,4,Phòng hội nghị có không gian rộng rãi với sức chứa hơn 120 khách.
56,5,"Những tiện ích khác: spa, phòng gym, phòng xông hơi, chỗ đỗ xe,..."
57,1,"Nằm đối diện bờ biển Nha Trang, ngay ngã 3 giao cắt giữa Trần Phú và Hoàng Diệu"
57,2,Hồ bơi chia 2 khu vực: Dành cho người lớn (1.7m) và dành cho trẻ em (1m)
57,3,"Nhà hàng và bar: Nhà hàng Xavia, Coffee Lounge, Pool Bar"
57,4,Dịch vụ hội họp và sự kiện: Phòng hội nghị tại tầng 3 với sức chứa 350 khách
57,5,"Nhiều tiện ích hấp dẫn: Phòng thể thao, spa, xông hơi khô, xông hơi ướt..."
58,1,Khách sạn chỉ cách bãi biển Mỹ Khê vài phút di chuyển
58,2,Thiết kế hiện đại mang phong cách Nhật Bản
58,3,"Phòng nghỉ đầy đủ tiện ích như: tivi màn hình phẳng, phòng tắm riêng, máy sấy tóc, két an toàn..."
58,4,"Khách sạn cũng sở hữu bể bơi vô cực độc đáo tại tầng thượng cùng với nhà hàng, quầy bar ấn tượng"
59,1,"Khách sạn với thiết kế sang trọng, ấn tượng cách bãi biển Mỹ Khê chỉ vài phút đi bộ"
59,2,"Khách sạn cung cấp đầy đủ các dịch vụ như: phòng nghỉ, nhà hàng, spa, chỗ đỗ xe miễn phí, câu lạc bộ trẻ em"
59,3,Bể bơi với khu vườn thoáng đãng của khách sạn nằm trên tầng thượng
59,4,"Nhà hàng của khách sạn phục vụ bữa sáng buffet và bữa trưa, bữa tối theo thực đơn hoặc yêu cầu của thực khách."
60,1,Tọa lạc giữa lòng thành phố biển xinh đẹp Nha Trang
60,2,Bể bơi ngoài trời với tầm nhìn hướng biển
60,3,Nhà hàng với thực đơn đa dạng và phong phú đáp ứng nhiều đối tượng du khách
60,4,"Phòng hội nghị sang trọng, đẳng cấp với đầy đủ các chức năng"
60,5,"Các tiện ích khác: phòng gym, phòng tắm hơi,.."
61,1,Vị trí gần các điểm tham quan nổi tiếng
61,2,Bể bơi ngoài trời với tầm nhìn hướng biển
61,3,"Không gian nhà hàng rộng rãi, phục vụ ẩm thực đa dạng"
61,4,"Tiện ích khác: lễ tân 24h, đưa đón sân bay,..."
62,1,Melia Đà Nẵng tọa lạc tại bãi biển Non Nước với bãi cát dài trắng mịn tuyệt đẹp
62,2,Khu nghỉ chỉ cách sân bay Đà Nẵng khoảng 15 phút di chuyển và Ngũ Hành Sơn vài phút đi bộ và phố cổ Hội An khoảng 20 phút lái xe
62,3,"Với kiến trúc hiện đại, khu nghỉ có bãi biển riêng, bể bơi ngoài trời, 2 nhà hàng phục vụ các món ăn Á, Âu theo thực đơn chọn món"
63,1,Tọa lạc tại trung tâm thành phố và sát mặt biển
63,2,Bể bơi ngoài trời tại tầng 27 với tầm nhìn hướng biển
63,3,Thưởng thức nền ẩm thực phong phú và đa dạng từ nhà hàng Amore và Felicita
63,4,Không gian hội nghị và tổ chức sự kiện linh hoạt cho mọi hình thức tổ chức
63,5,"Các dịch vụ tiện ích khác: phòng spa, gym,..."
64,1,"Nằm ở trung tâm thành phố thuận lợi cho việc di chuyển, tham quan vui chơi"
64,2,Sở hữu bể bơi vô cực với tầm nhìn hướng biển
64,3,Hệ thống nhà hàng và quầy bar Venue cung cấp đồ ăn đa dạng cho khách
64,4,"Hoạt động tiện ích khác: kids meal, lễ tân 24/24,..."
65,1,Khách sạn tọa lạc tại mặt biển Đà Năng với tầm nhìn thoáng đãng
65,2,"Mỗi phòng đều có đầy đủ tiện nghi phòng nghỉ như: điều hòa, két an toàn, tivi màn hình phẳng, phòng tắm riêng"
65,3,"Khách sạn còn có bể bơi ngoài trời, nhà hàng và phòng xông hơi khô"
66,1,Nằm cách bãi biển Nha Trang 1 phút đi bộ
66,2,Sở hữu bể bơi ngoài trời rộng rãi
66,3,"Nhà hàng, bar phục vụ đủ loại món ăn địa phương và cung cấp nhiều lựa chọn đồ uống"
66,4,Phòng họp Ballroom rộng 320m2 dành cho những cuộc họp có quy mô vừa và lớn của doanh nghiệp
66,5,"Tiện ích hấp dẫn như: khu vực dành cho trẻ em, dịch vụ Spa-Massage,..."
67,1,"Khách sạn với thiết kế vô cùng ấn tượng, cảnh quan xanh mát được bao phủ bởi cây xanh"
67,2,Ngay phía trước khách sạn là mặt biển Đà Nẵng mênh mông và thoáng đãng
67,3,Tất cả các phòng đều được trang bị đầy đủ thiết bị hiện đại và đẹp mắt
67,4,"Khách sạn phục vụ bữa sáng buffet và bữa trưa, bữa tối theo thực đơn có sẵn hoặc theo yêu cầu của thực khách"
68,1,Hồ bơi ngoài trời với tầm nhìn bao trọn cảnh biển
68,2,"Nhà hàng phục vụ thực đơn đa dạng, ẩm thực Âu - Á độc đáo"
68,3,"Tiện ích khác: dịch vụ Spa, phòng Gym,..."
69,1,Lotte Hotel Hanoi là sự kết hợp độc đáo giữa lòng hiếu khách nồng hậu của Hàn Quốc và nền văn hóa Việt Nam đầy màu sắc
69,2,"Khách sạn cung cấp nhiều địa điểm trang nhã phù hợp với mọi dịp như hội nghị quốc tế, hội thảo kinh doanh, sự kiện ra mắt sản phẩm mới, tiệc tùng, đám cưới và họp mặt gia đình"
69,3,"Được thiết kế như một tác phẩm nghệ thuật thực sự, tự hào với tầm nhìn toàn cảnh thành phố Hà Nội tuyệt đẹp về đêm và các buổi biểu diễn nhạc sống sôi động"
69,4,"Nằm trên những tầng cao nhất của toà nhà 65 tầng tráng lệ, khách sạn Lotte Hà Nội tự hào là đại diện cho tiêu chuẩn khách sạn 5 sao quốc tế mới tại Hà Nội nói riêng và Việt Nam nói chung."
70,1,Silk Queen Grand Hotel có hồ bơi ngoài trời và tầm nhìn ra quang cảnh thành phố
70,2,"Tại đây, bạn có thể tận hưởng những trải nghiệm thư giãn tuyệt vời như mua sắm tại các cửa hàng trong khuôn viên khách sạn"
70,3,"Khách sạn cung cấp một trung tâm thể dục đầy đủ, nơi du khách có thể tập luyện và rèn luyện sức khỏe"
70,4,"Với diện tích từ 26 đến 60 mét vuông, các loại phòng bao gồm Deluxe Inner View Room, Grand Luxury, Luxury Double or Twin, Luxury Family và Suite Balcony."
71,1,Khách sạn có vị trí tuyêt đẹp nhìn thẳng ra sông Hàn thơ mộng của thành phố Đà Nẵng
71,2,Mỗi phòng của khách sạn đều được trang bị nội thất hiện đại cùng cửa sổ lớn để du khách có thể ngắm nhìn toàn cảnh Đà Nẵng
71,3,"Khách sạn sở hữu nhà hàng rộng rãi, bể bơi ngoài trời cùng Spa đẳng cấp"
72,1,"Vị trí nằm ngay trung tâm, gần Cầu Rồng và Cầu Sông Hàn, tòa nhà văn phòng & cách biển Mỹ Khê ~2km"
72,2,Chất lượng dịch vụ và trang thiết bị hướng tới chuẩn khách sạn 4* quốc tế
72,3,"Có đủ các tiện nghi và dịch vụ: Aroma Spa, Nyx Sky Lounge, Mandarin Restaurant, Pool Bar, Firgun Corner Coffee, Gym Center"
73,1,"Nằm ở khu riêng biệt trên đảo Hòn Tre, thích hợp cho nghỉ dưỡng"
73,2,"Bể bơi chính rộng lớn hướng biển với diện tích lên đến 1.700m2, bên cạnh đó, mỗi villa cũng có bể bơi riêng"
73,3,"Hệ thống ẩm thực tinh tế luôn sẵn sàng phục vụ khách lưu trú bao gồm 05 nhà hàng và 03 quầy bar: nhà hàng Buffet Windy, nhà hàng Clubhouse Pebble, nhà hàng Greens, Aqua Bar, Lobby Bar,..."
73,4,"Hệ thống phòng hội họp rộng rãi, sức chứa lớn với đầy đủ các thiết bị âm thanh, ánh sáng hiện đại, cao cấp"
74,1,"Không gian phòng nghỉ sang trọng, đẳng cấp đạt chuẩn 5 sao"
74,2,Bể bơi vô cực với hướng nhìn toàn cảnh thành phố Nha Trang
74,3,"Nằm ngay trong nội đô thành phố Nha Trang, thuận tiện để di chuyển đến các điểm tham quan du lịch"
75,1,"Là khu nghỉ dưỡng duy nhất có nguồn nước khoáng nóng với hàm lượng khoáng cao ngay trong nội khu, được sách kỷ lục Việt Nam ghi nhận là 1 trong 5 suối khoáng tốt nhất Việt Nam ."
75,2,"Toạ lạc tại thôn Kênh Gà, Ninh Bình chỉ cách Hanoi chưa đến 100km, thuận tiện cho du khách vừa nghỉ dưỡng vừa khám phá thiên nhiên hoang sơ của Ninh Bình"
75,3,"Với hệ thống suối khoáng nóng tự nhiên, bạn sẽ được tận hưởng những lợi ích tuyệt vời cho cơ thể và tinh thần."
75,4,ại đây có nguồn khoáng nóng tự nhiên với 5 loại muối khoáng và nhiệt độ ổn định quanh năm 53oC rất tốt cho sức khoẻ.
76,1,"Tọa lạc ở Ninh Bình, cách Chùa Bái Đính 27 km, Tam Coc Lion Kings Hotel & Resort cung cấp chỗ nghỉ có xe đạp miễn phí, chỗ đậu xe riêng miễn phí, hồ bơi ngoài trời và khu vườn."
76,2,"Nơi bạn có thể ngắm nhìn vẻ đẹp hùng vĩ của núi non Tam Cốc hay đơn giản là dạo bước quanh những con đường trong xanh, hòa mình vào vẻ đẹp thiên nhiên tươi mới mỗi độ xuân về."
76,3,Khám phá bức tranh sống động của thiên nhiên tại Tam Coc Lion Kings Hotel & Resort
77,1,"Với gam màu trầm ấm áp, điểm vào đó những mảng gốm mosaic độc đáo, các vật dụng mỹ nghệ tinh xảo cùng hướng nhìn đồng lúa uốn lượn bên dãy núi tuyệt đẹp, gợi lên không gian sống của những gia đình vương giả xưa."
77,2,"Các nhà hàng của khách sạn Ninh Bình Hidden Charm sẽ dẫn lối các thực khách trải nghiệm từng phong vị riêng qua những món ăn dân dã rất đặc trưng như cơm cháy, thịt dê… đến những tinh hoa của ẩm thực Việt Nam và quốc tế"
77,3,"Nằm giữa khu vườn xanh mát và được trang trí tinh tế, thực khách có những phút giây thư thái nhất trong hành trình khám phá ẩm thực của vùng đất cố đô Ninh Bình."
77,4,"Ninh Bình Hidden Charm đưa quý khách đến một thiên đường của sự bình yên và thư giãn tuyệt đối, đánh thức tất cả các giác quan giúp phục hồi năng lượng sau một ngày tham quan mệt mỏi và giúp trẻ hóa cơ thể."
78,1,"Vị trí thuận tiện, dễ dàng di chuyển đến chợ đêm Nha Trang, quán Sailing Club, Trung tâm Thuyền buồm Việt Nam,..."
78,2,Thư giãn với bể bơi ngoài trời nằm trên tầng 21 của khách sạn.
78,3,"Nhà hàng phục vụ đa dạng các phong vị ẩm thực châu Âu, châu Á."
78,4,"Dịch vụ tiện ích khác: lễ tân 24/7, bãi đỗ xe, wifi miễn phí,..."
79,1,"Vị trí thuận tiện, gần với Trung tâm Thuyền buồm Việt Nam, quán Sailing Club, chợ đêm Nha Trang,..."
79,2,Thư giãn với hồ bơi vô cực nằm trên tầng 7 của khách sạn.
79,3,Nhà hàng phục vụ đa dạng phong vị ẩm thực Á - Âu với hướng nhìn ra biển.
79,4,"Tiện ích khác: gym, lễ tân 24/7, wifi miễn phí,..."
80,1,Nằm ở vị trí đắc địa tại bãi biển Tuy Hòa
80,2,Nhà hàng mang đến nền ẩm thực đa dạng
80,3,Phòng hội họp được trang bị đầy đủ tiện nghi
80,4,"Các tiện ích khác: lễ tân trực 24/24, chỗ đỗ xe,..."
81,1,Salmalia Boutique Hotel & Spa nằm trên trục đường song song với cung đường dọc bãi biển đẹp nhất hành tinh.
81,2,Hồ bơi với pool bar độc đáo nằm ngang mặt nước với sục Jacuzzi
81,3,Mỗi phòng được thiết kế tinh tế hòa cùng màu tranh của Họa sĩ nổi tiếng Vũ Dương mang cảm giác rất thơ đến với người trải nghiệm
81,4,Nhà hàng Salmalia Restaurant với sự tài hoa của Bếp trưởng 5*
82,1,Sở hữu vị trí đắc địa cách bờ biển chỉ 1 phút đi bộ và nằm gần nhiều điểm tham quan du lịch nổi tiếng
82,2,Bể bơi vô cực với góc nhìn hướng ra biển đem lại trải nghiệm mới lạ cho du khách.
82,3,"Nhà hàng nổi tiếng với các món Á, Âu và Việt Nam mang cho lữ khách hương vị không thể nào quên."
82,4,"Tiện ích khác: dịch vụ Spa, phòng Gym & Yoga,..."
83,1,Eli Rina Hotel Hanoi mang vẻ đẹp xa hoa của lối kiến trúc Đông Dương cùng với tiện nghi cao cấp và phong cách phục vụ khách sạn 4 sao
83,2,"Vị trí gần trung tâm cho phép du khách dễ dàng khám phá lịch sử, văn hoá và ẩm thực Thủ đô."
83,3,"Nội thất thanh lịch, tiện nghi hiện đại và ban công riêng với tầm nhìn tuyệt đẹp, nơi đây là sự lựa chọn lí tưởng cho những du khách tìm kiếm trải nghiệm tuyệt vời với giá cả hợp lý."
84,1,Khách sạn Vanda Đà Nẵng tọa lạc trên con đường sầm uất nối thẳng đến Cầu Rồng nổi tiếng Đà Nẵng
84,2,Khách sạn cung cấp các phòng hội nghị có sức chứa lên đến 150 khách cũng như tổ chức tiệc cho 200 khách
84,3,"Mỗi phòng của khách sạn đều được trang bị nội thất hiện đại, đẹp mắt và tầm nhìn thoáng đãng"
85,1,"Khách sạn nằm trên phố Trần Bạch Đằng, cách bãi biển Mỹ Khê chỉ vài phút đi bộ"
85,2,"Các phòng nghỉ đều được trang bị đầy đủ nội thất cao cấp, hiện đại"
85,3,"Khách sạn cũng sở hữu bể bơi ngoài trời, nhà hàng và sky bar đẹp mắt"
86,1,"Nằm ở trung tâm các điểm thăm quan nổi tiếng của Ninh Bình và có nhà hàng, dịch vụ phòng, quầy bar, khu vườn, hồ bơi ngoài trời mở quanh năm cũng như sân hiên phơi nắng"
86,2,"Tất cả các căn có phòng tắm riêng, vòi sen, điều hòa, TV màn hình phẳng và tủ lạnh. Scenic Mountain Ecolodge Ninh Binh có phục vụ bữa sáng thực đơn à la carte hoặc kiểu lục địa."
86,3,Scenic Mountain Ecolodge Ninh Binh cách Chùa Bái Đính 18 km và Nhà thờ đá Phát Diệm 32 km.
87,1,Vị trí thuận lợi để di chuyển đến các điểm tham quan nổi tiếng của Phú Quốc
87,2,Hồ bơi rộng lớn với diện tích 700m2
87,3,Nhà hàng phục vụ đa dạng ẩm thực Á-Âu
88,1,"Có bãi biển riêng trải dài, tất cả các hạng phòng đều có ban công riêng"
88,2,Hồ bơi vô cực bên bờ biển xanh
88,3,"Hệ thống nhà hàng và quán bar: The Kitchen, Sol Sets Rooftop, The Shack, Pool Bar, Ginger Bar"
88,4,Body & Sol Spa với 4 phòng spa trong nhà và 1 spa ngoài trời mang đến chương trình trị liệu và detox tuyệt vời
88,5,"Các hoạt động đặc biệt: Yoga sáng và hoàng hôn, kayak, đạp xe, bóng chuyền bãi biển, trải nghiệm khám phá địa phương..."
89,1,Gần Grand World Phú Quốc với nhiều điểm check in hấp dẫn.
89,2,"Nhà hàng và Bar: nhà hàng Ola Costa, Scorpio Bar."
89,3,Bể bơi 800m2 với tầm nhìn khoáng đạt.
89,4,Số lượng phòng nghỉ lớn: 687 phòng
90,1,"Khách sạn tọa lạc trên mặt đường Võ Nguyên Giáp, phía trước là bãi biển Mỹ Khê tuyệt đẹp"
90,2,"Tất cả các phòng đều được trang bị đầy đủ thiết bị nội thất hiện đại, cao cấp"
90,3,Khách sạn sở hữu bể bơi ngoài trời độc đáo và đẹp mắt
91,1,Vị trí thuận lợi cho di chuyển tới các địa điểm du lịch nổi tiếng
91,2,Nhà hàng mang đến nền ẩm thực Á - Âu đa dạng
91,3,"Các tiện ích khác: dịch vụ phòng, xe đưa đón tại sân bay,..."
92,1,Bể bơi ngoài trời với hướng nhìn ra biển
92,2,"Khuôn viên vườn cây xanh mát, thích hợp cho check in"
92,3,Nhà hàng Tahiti Beach có thực đơn đa dạng phong phú chuyên phục vụ khách lưu trú tại khách sạn
93,1,"Vị trí thuận lợi, nằm ở gần biển và gần các địa điểm du lịch nổi tiếng."
93,2,Bể bơi ngoài trời với hướng nhìn ra biển.
93,3,Nhà hàng phục vụ các món ăn Á - Âu đa dạng
93,4,"Các tiện ích khác: quán bar, cho thuê xe hơi,..."
94,1,Khu nghỉ dưỡng bao gồm cả phòng khách sạn và biệt thự riêng tư
94,2,Không gian xanh mát với nhiều cây xanh tạo cho khu nghỉ sự gần gũi với thiên nhiên và thư giãn
94,3,"Nhà hàng rộng rãi phục vụ bữa sáng buffet với thực đơn phong phú, phù hợp khẩu vị của thực khách"
95,1,Vị trí gần biển
95,2,Hồ bơi ngoài trời với tầm nhìn đẹp
95,3,Nhà hàng phục vụ đa dạng các món ăn đặc sản tươi sống.
96,1,Bãi biển riêng và cụm hồ bơi riêng biệt nằm trong khuôn viên
96,2,Hệ thống nhà hàng Horizons và quầy bar liên tục thay đổi hài hòa và xuyên suốt các món ăn phục vụ khách lưu trú
96,3,"Tiện ích khác: Spa, câu lạc bộ Amber Sands ,...."
97,1,"Vị trí trung tâm phố, gần sân bay, cách cầu sông Hàn 700m, cách chợ Cồn - chợ Hàn 500m, cách biển 1.5km"
97,2,"Khách sạn có tầm nhìn toàn cảnh thành phố Đà Nẵng, bể bơi vô cực, nhà hàng, spa, gym và phòng chơi cho trẻ em"
97,3,Nhà hàng phục vụ bữa sáng buffet hàng ngày
98,1,"Toạ lạc tại thiên đường biển Mỹ Khê, Estrella Boutique Hotel sở hữu vị trí đắc địa, chỉ cách bãi biển 500m, cách trung tâm thành phố chỉ 5 phút đi xe"
98,2,"Khách sạn được xây dựng theo phong cách Rustic, đó là sự kết hợp hài hoà giữa những đường nét tối giản và mộc mạc"
98,3,"Estrella có đầy đủ tiện nghi từ nhà hàng, hồ bơi, phòng gym, spa, xông hơi và quầy bar"
99,1,"Vị trí: tọa lạc ngay trung tâm phường Dương Đông, Phú Quốc."
99,2,Bể bơi Sunset với tầm nhìn hướng ra đại dương
99,3,"Hệ thống nhà hàng & quầy bar đẳng cáp: nhà hàng Aroma, Pool Bar, Sense Lounge"
99,4,02 phòng họp Sapphire và Ruby có sức chứa từ 40 - 160 khách
99,5,"Tiện ích khác: dịch vụ Spa, phòng Gym, Kids Club,..."
100,1,"Nằm ở vị trí trung tâm Dương Đông, thuận tiện cho quý khách lui tới các điểm tham quan tham quan thu hút của địa phương"
100,2,Hồ bơi vô cực trong nhà và ngoài trời
100,3,"Nhà hàng Soleil Fusion phục vụ đa dạng món ăn phong cách Á - Âu , có sức chứa 100 khách."
100,4,"Phòng hội họp có thiết kế trang nhã , sang trọng"
100,5,"Tiện ích khác: Gym, Sunset Spa, cửa hàng lưu niệm,..."
101,1,"Khách sạn tọa lạc trên đường Võ Nguyên Giáp, con đường biển đẹp nhất Đà Nẵng"
101,2,Tất cả các phòng nghỉ của khách sạn đều được trang bị đầy đủ nội thất hiện đại
101,3,Bể bơi ngoài trời của khách sạn tại tầng thượng có tầm nhìn toàn cảnh biển Đà Nẵng
102,1,"Nằm ở vị trí trung tâm Dương Đông, thuận tiện cho quý khách lui tới các điểm tham quan tham quan thu hút của địa phương"
102,2,Hồ bơi và cafe tại sân thượng đầy ấn tượng
102,3,Dịch vụ Buffet sáng Á – Âu.
103,1,"Vị trí: tọa lạc ngay trung tâm phường Dương Đông, Phú Quốc."
103,2,Sở hữu bãi biển riêng nên rất thuận tiện cho khách lưu trú tắm biển và tham gia các hoạt động thể thao dưới nước.
103,3,"Hệ thống nhà hàng & quầy bar đẳng cáp: nhà hàng Le Bateau, Sea & Sail Pool Bar"
103,4,"Tiện ích khác: dịch vụ Spa, phòng Gym, Kids Club,..."
104,1,Khách sạn tọa lạc trên mặt đường Võ Nguyên Giáp ngay bên cạnh bãi biển Mỹ Khê tuyệt đẹp
104,2,"Các phòng của khách sạn đều được trang bị đầy đủ thiết bị hiện đại, trang nhã"
104,3,Bể bơi ngoài trời tại tầng thượng với tầm nhìn toàn cảnh biển Đà Nẵng
105,1,Duc lịch vui vẻ tuyệt vời không bia rượu
106,1,Vị trí: Nằm trên bãi Ông Lang - một trong những bãi biển đẹp nhất đảo Phú Quốc
106,2,Bể bơi ngoài trên siêu rộng cùng làn nước luôn trong xanh
106,3,"Nhà hàng phục vụ món ăn đa dạng, phong phú"
106,4,"Tiện ích khác : phòng tập Gym, dịch vụ Spa, quầy Bar, Công viên giải trí, ..."
107,1,"Khu nghỉ mang đậm phong cách Nhật Bản với thiết kế mới, hiện đại và đầy đủ tiện ích"
107,2,Khu nghỉ có công viên nước hiện đại với nhiều trò chơi rất phù hợp cho gia đình có trẻ nhỏ
107,3,"Tất cả các phòng nghỉ đều có diện tích rộng rãi, thoáng mát"
108,1,Vị trí: Nằm trên bãi Ông Lang - một trong những bãi biển đẹp nhất đảo Phú Quốc
108,2,Bể bơi ngoài trên siêu rộng cùng làn nước luôn trong xanh
108,3,"Nhà hàng phục vụ món ăn đa dạng, phong phú"
108,4,"Tiện ích khác : phòng tập Gym, dịch vụ Spa, quầy Bar,..."
