hotel_id,block_id,data
109,1,"Ru giấc giữa mây ngàn trong không gian ấm áp, đầy cảm hứng, thu hút với phong cách tối giản sang trọng kết hợp cùng họa tiết trang trí mang âm hưởng Tây Bắc tại các phòng nghỉ dưỡng của Lady Hill Sapa Resort."
109,2,"Lady Hill Sapa Resort chào đón bạn bằng một ""khoảnh khắc chạm mây ngàn"" đầy cảm hứng, nơi mọi nỗi lo lắng sẽ bị ""thổi bay"" trong không gian thư giãn và yên bình của đồi núi Sa Pa"
109,3,"Tại Lady Hill Sapa Resort, mỗi khoảnh khắc đều là một hành trình khám phá và hòa mình vào vẻ đẹp của thiên nhiên"
109,4,"Lady Hill Sapa Resort – Nơi từng chiếc lá, từng trái cây kể câu chuyện về sự tinh túy và thuần khiết từ thiên nhiên"
110,1,Khu nghỉ dưỡng với diện tích lên tới hơn 15 héc-ta có vị trí nhìn thẳng ra bãi biển Non Nước tuyệt đẹp
110,2,Fusion Resort & Villas có 85 biệt thự riêng tư cùng 127 phòng khách sạn
110,3,"Khu nghỉ cũng sở hữu hệ thống nhà hàng, bể bơi, spa, quầy bar với đầy đủ nội thất hiện đại và sang trọng"
111,1,Hồ bơi bốn mùa được chia làm hai khu vực cho người lớn và trẻ em
111,2,Nhà hàng có thực đơn đa dạng các món kiểu Á-Âu chuyên phụ vụ khách lưu trú tại khách sạn
111,3,"Phòng tổ chức hội họp, tiệc, trung tâm dịch vụ doanh nhân có diện tích rộng, đầy đủ âm thanh ánh sáng."
111,4,"Các hoạt động dịch vụ khác tại khách sạn: phòng GYM, Spa, Bida,...."
112,1,Sapa Jade Hill Resort & Spa là khu nghỉ dưỡng rất phù hợp để nghỉ dưỡng cùng gia đình hay tận hưởng sự lãng mạn dành cho các cặp đôi.
112,2,"Bước vào bản làng nhỏ Sapa Jade Hill Resort & Spa, hơi ấm lan tỏa từ những nụ cười nồng hậu của các bạn nhân sự bản địa, hơi ấm bay nhẹ từ lò sưởi củi bập bùng và từ cả những bữa ăn quầy quần ấm cúng."
112,3,"""Bản làng"" Sapa Jade Hill những ngày này sau buổi sáng chìm trong biển mây là đến lúc khoảng trời trong xanh, nắng nhẹ, và những cơn gió mát lành dần ùa về."
112,4,"Thong thả dạo bước dọc lối nhỏ thân quen, đâu cũng là những góc check in thật xinh xắn, cùng bạn và những người thương yêu lưu lại những kỷ niệm thật đẹp tại  bản làng cổ tích Sapa Jade Hill."
113,1,"Thả hồn giữa bầu trời Sapa rực rỡ, thả dáng giữa khu vườn nên thơ, thả trôi tất cả âu lo trong chuyến đi ngập tràn sắc màu thanh xuân tại Pao's Sapa - điểm đến yêu thích của những nàng thơ giữa mây trời Tây Bắc."
113,2,"Nằm trên sườn đồi giữa những ngọn núi hùng vĩ với tầm nhìn ngoạn mục ra thung lũng Mường Hoa thơ mộng và dãy núi Hoàng Liên Sơn hùng vĩ, Pao's Sapa Leisure tự hào là hiện thân của sự sang trọng bậc nhất tại trung tâm thị trấn miền núi Sapa."
113,3,Pao's Sapa Leisure Hotel là điểm đến tuyệt vời cho chuyến tham quan sẽ kích thích các giác quan và trẻ hóa tâm hồn.
113,4,"Tất cả các phòng đều có tiện nghi riêng, không gian thoáng đãng và ban công lãng mạn nhìn ra quang cảnh thiên nhiên hùng vĩ của vùng Tây Bắc."
114,1,"Tất cả các phòng đều sở hữu tầm nhìn hướng ra thung lũng Mường Hoa thơ mộng, mang lại cảm giác thư thái và yên bình."
114,2,"Tự hào là một trong những khách sạn cao cấp nhất tại thị trấn Sapa, KK Sapa Hotel xây dựng đội ngũ chuyên gia, đầu bếp đến từ cả ba miền Việt Nam và nước ngoài nhằm đem đến cho khách hàng trải nghiệm phong phú, trọn vẹn nhất."
114,3,"Hoa Ban có diện tích lớn nhất trong hệ thống các phòng Hội nghị của khách sạn, được đánh giá là lựa chọn hàng đầu để tổ chức sự kiện cho các doanh nghiệp lớn Chi tiết"
114,4,"Spa của KK Sapa Hotel nằm ở tầng 11, là Spa lớn nhất, hiện đại nhất tại Sapa. Dao Spa được đầu tư xây dựng với tiêu chí phục vụ khách hàng cao cấp với đầy đủ các tiện ích. Phòng Spa trọn gói bao gồm: dịch vụ xông hơi, tắm lá thuốc, massage …"
115,1,Mỗi phòng nghỉ tại Silk Path Grand Sapa Resort & Spa là sự kết hợp hài hòa giữa kiến trúc Châu u thanh lịch với những nét chấm phá tinh hoa dân tộc thiểu số khu vực Tây Bắc.
115,2,"Nuông chiều vị giác với những món ăn tinh hoa tại Silk Path Grand Sapa Resort & Spa, kết hợp hài hòa, tinh tế giữa nét độc đáo hương vị đặc trưng của vùng núi Tây Bắc và sự đa dạng trong văn hóa ẩm thực Đông Tây."
115,3,Silk Path Grand Sapa Resort & Spa sở hữu hệ thống cơ sở vật chất giải trí hiện đại bậc nhất Sa Pa
115,4,"Cho dù là một bữa tiệc thân mật hay hội nghị, hội thảo quốc tế, hãy để sự kiện của bạn trở nên độc đáo hơn khi tổ chức tại Silk Path Grand Sapa Resort & Spa."
116,1,Vị trí thuận lợi di chuyển đến các địa điểm nổi bật của Phú Quốc
116,2,Bể bơi vô cực giữa rừng xanh
116,3,Nhà hàng Cá Gỗ phục vụ những món ăn độc đáo với không gian xung quanh là núi rừng và biển.
116,4,"Phòng họp và hội nghị sang trọng được trang bị đầy đủ tiện nghi hiện đại, phù hợp với các cuộc họp nội bộ công ty hay họp với đối tác."
116,5,"Các tiện ích khác: spa, khu vui chơi cho trẻ em, phòng tập gym, khu vực bi-a, tham quan hai hồ nuôi cá Koi lớn ngoài trời, tour tham quan Phú Quốc trọn gói,..."
117,1,"Hồ bơi ngoài trời thoáng đãng, trải dài theo khuôn viên resort."
117,2,"Nhà hàng Essence, Oasis và CView Bar chuyên cung cấp những món ăn hảo hạng cho khách."
117,3,"Phòng sự kiện với diện tích 347m2, được trang bị đầy đủ hệ thống âm thanh, ánh sáng, trình chiếu,... hiện đại nhất."
117,4,"Những tiện ích khác: Spa, phòng gym, lướt ván, tắm biển,..."
118,1,Khu nghỉ tọa lạc trên đường Trường Sa gần với danh thắng Ngũ Hành Sơn
118,2,"Khu nghỉ sỡ hữu bãi biển riêng, 2 bể bơi rộng, nhà hàng, quầy ba, spa và sân tennis"
118,3,"Các phòng nghỉ đều rộng rãi và được trang bj đầy đủ nội thất sang trọng, hiện đại"
119,1,"Nằm ở Bãi Trường ,gần các địa điểm nổi tiếng trên đảo"
119,2,"Resort có hồ bơi được đặt vị trí trung tâm của khu nghỉ dưỡng, view hướng biển tuyệt đẹp"
119,3,Nhà hàng phục vụ đa dạng món ăn Á-Âu
119,4,"Các dịch vụ tiện ích khác như: mini bar, spa ,massage, ..."
120,1,Furama Resort Đà Nẵng với thiết kế mang đậm phong cách Indochina sang trọng
120,2,"Khu nghỉ sở hữu bể bơi nước ngọt, nhà hàng, quầy bar, spa với các phương pháp trị liệu chuyên sâu"
120,3,"Nhà hàng của khu nghỉ phục vụ  bữa sáng buffet, bữa trưa và bữa tối theo thực đơn có sẵn các món Á, Âu, truyền thống Ý"
121,1,"Giữa lòng phố núi mờ sương ấy, DeLaSol Sapa Hotel như một nốt nhạc êm đềm, chào đón bạn đến với hành trình khám phá xứ sở mây ngàn"
121,2,Ngắm nhìn thung lũng Mường Hoa ngay tại ban công nhà hàng chính là điểm nhấn lãng mạn trong hành trình khám phá vị ngon Tây Bắc của thực khách khi lưu trú DeLaSol Sapa Hotel
121,3,"Nơi ban công phòng nghỉ ngắm trọn khung cảnh biển mây bay bồng bềnh, nơi tách trà ấm cùng chiếc bánh ngọt mang lại cảm giác thư giãn và nơi mọi khoảnh khắc tuyệt vời ấy đã được ghi lại qua những bức ảnh tuyệt đẹp."
122,1,"ước chân vào khách sạn, du khách thực sự bị ấn tượng bởi những họa tiết hoa văn đẹp mắt trên các sản phẩm thổ cẩm được sử dụng làm điểm nhấn cho không gian nội thất từ các bức tranh treo tường, gối, thảm,…"
122,2,"Kết hợp tông màu trầm nền nã và những vật dụng quen thuộc được biến tấu khác lạ, xu hướng “vinh danh bản sắc” đã trở thành chủ đề xuyên suốt trong thiết kế nội thất của khách sạn."
122,3,"Lựa chọn Pistachio Hotel Sapa, du khách còn được tận hưởng trọn vẹn các dịch vụ đẳng cấp như Bể bơi vô cực, Bể bơi 4 mùa, Phòng tập Gym, Quầy Bar, Dịch vụ Spa thư giãn, Phòng Karaoke"
123,1,"Hãy tưởng tượng bạn đang ngồi trước ban công phòng, trước mắt là thung lũng Mường Hoa thơ mộng, xa xa là những thửa ruộng bậc thang đang mùa xanh ngát."
123,2,"Tận hưởng không gian riêng tư, hòa mình vào thiên nhiên với bungalow rộng rãi, đầy đủ tiện nghi."
123,3,"Phòng cao cấp với tầm nhìn ngoạn mục ra dãy Hoàng Liên Sơn hùng vĩ, mang đến trải nghiệm nghỉ dưỡng đẳng cấp."
124,1,Khách sạn đầu tiên của Shilla Monogram tại Đà Nẵng- Việt Nam
124,2,"Thiết kế hiện đại, sang trọng mang phong cách Hàn Quốc kết hợp văn hóa Việt Nam"
124,3,"Khách sạn sở hữu bãi biển riêng cùng bể bơi, nhà hàng, spa với các phương pháp trị liệu chuyên sâu, hiệu quả"
125,1,"Aqua Pool với tầm nhìn bao trọn cảnh biển, bên cạnh đó tất cả các villa đều có hồ bơi, sân vườn riêng"
125,2,"Hệ thống nhà hàng & quầy bar cao cấp: Nhà hàng Ando Bistro, Ando Beach Bar"
125,3,"Phòng hội họp trang bị đầy đủ các thiết bị âm thanh, ánh sáng"
125,4,Andochine Spa & Wellness với các phương pháp trị liệu từ thiên nhiên
125,5,"Các sự kiện giải trí: Live music, DJ show, Taste The Sunset Show, các hoạt động thể thao trên biển,..."
126,1,Amazing mong bạn đến Sapa ngày gần nhất để tận hưởng mùa thu nơi rẻo cao để lòng mình ăm ắp cảm xúc rộn ràng xen lẫn bình yên.
126,2,"Amazing Hotel Sapa mang đến cho bạn những hương vị Việt Nam trứ danh, đậm đà và khó quên."
126,3,"Sau cả ngày khám phá Sapa, còn gì tuyệt vời hơn khi được thư giãn và tái tạo năng lượng với liệu pháp spa thảo dược truyền thống của người Dao Đỏ tại Amazing Hotel Sapa."
126,4,"Không gian spa tại Amazing Hotel Sapa thơm dịu mùi thảo dược, mang lại cảm giác thanh bình, giúp bạn thả lỏng và tận hưởng sự an yên."
127,1,"Với thiết kế ấn tượng, trang bị đầy đủ hệ thống âm thanh ánh sáng tối tân, đội ngũ nhân viên chuyên nghiệp. Hứa hẹn mang thành công tới mọi bữa tiệc, sự kiện lớn nhỏ của Du khách."
127,2,"Nhà hàng sang trọng, có sức chứa 250 khách, mở ra một không gian trải nghiệm ẩm thực đặc sắc với tầm nhìn tuyệt đẹp hướng thung lũng và menu đa dạng các món ăn từ Á - Âu."
127,3,"Trong không gian yên tĩnh với hương thảo mộc nhẹ dịu, từng động tác massage chuyên nghiệp, tinh tế và tắm lá thuốc Dao đỏ giúp bạn lấy lại cân bằng cho cơ thể, tận hưởng sự thư giãn tuyệt đối."
127,4,"Bamboo Eden gây ấn tượng nhờ thiết kế độc đáo, đem đến cho Du khách cảm giác chạm tay tới khoảnh khắc hòa cùng mây trời trong không gian đầy thơ mộng."
128,1,My Gallery Boutique Hotel & Spa là lựa chọn sáng giá dành cho những ai đang tìm kiếm một trải nghiệm xa hoa đầy thú vị trong kỳ nghỉ của mình.
128,2,Lưu trú tại đây cũng là cách để quý khách chiều chuộng bản thân với những dịch vụ xuất sắc nhất và khiến kỳ nghỉ của mình trở nên thật đáng nhớ.
128,3,Khách sạn này là lựa chọn hoàn hảo cho các kỳ nghỉ mát lãng mạn hay tuần trăng mật của các cặp đôi.
128,4,"Với thiết kế độc đáo, My Gallery Boutique Hotel & Spa mang đến không gian lưu trú làm hài lòng quý khách."
129,1,"Grand Flamant Sapa Hotel  - điểm dừng chân lý tưởng cho những người yêu thích sự tiện lợi, không gian riêng tư."
129,2,Khách sạn Grand Flamant Sapa không chỉ mang đến một trải nghiệm nghỉ dưỡng tuyệt vời mà còn cung cấp nhiều tiện nghi giải trí hấp dẫn
129,3,"Tiết kiệm, trải nghiệm và tận hưởng đúng nghĩa bằng sự tiện nghi, chuyên nghiệp của khách sạn với đầy đủ các dịch vụ hấp dẫn theo tiêu chuẩn 3 sao"
130,1,"Khách sạn Mường Thanh Sapa được thiết kế với hệ thống 96 phòng nghỉ, tất cả đều đạt chuẩn, đầy đủ các tiện nghi với nhiều dịch vụ cần thiết đi kèm nhằm đáp ứng nhu cầu của bạn trong thời gian nghỉ dưỡng tại đây."
130,2,"Một điều độc đáo để tạo nên điểm khác biệt của Khách sạn Mường Thanh Sapa chính là kiến trúc, nó được kết hợp hài hòa giữa phong cách hiện đại sang trọng và nét bình dị trong vẻ đẹp văn hóa của người dân đồng bào Tây Bắc."
130,3,"Đặc biệt, Khách sạn Mường Thanh Sapa có tầm nhìn hướng ra hồ với mặt nước long lanh, tựa như mắt rồng in bóng toàn bộ khuôn viên khiến cho không gian khung cảnh nơi đây ngày càng thơ mộng."
131,1,"Tất cả các phòng được thiết kế có ban công hoặc cửa sổ với tầm view rộng và thoáng  đãng, nhìn xuống thung lũng Mường Hoa thơ mộng và dãy núi Hoàng Liên Sơn hùng vĩ, đỉnh Fansipan."
131,2,"Mỗi phòng nghỉ đều được thiết kế trang nhã với đồ nội thất hiện đại và có máy điều hòa hai chiều, thiết bị sưởi cũng như két an toàn cá nhân."
131,3,Nhà hàng và bar tầng trên cùng sức chứa 120 khách rất phù hợp với khách đoàn tổ  chức sự kiện Gala dinner ngoài trời.
132,1,"My Boutique Hotel & Spa sẽ là lựa chọn lưu trú hoàn hảo, nơi cung cấp các tiện nghi chất lượng và dịch vụ tuyệt vời."
132,2,"Không chỉ sở hữu vị trí đắc địa, My Boutique Hotel & Spa còn là một trong những khách sạn nằm cách Chợ đêm Sapa chưa đầy 1,17 km và Thác Bạc chưa đầy 7,85 km."
132,3,Khách sạn này là lựa chọn hoàn hảo cho các kỳ nghỉ mát lãng mạn hay tuần trăng mật của các cặp đôi.
133,1,"Cùng với đó là thiết kế nội thất tinh tế và đa dạng,  là sự lựa chọn lý tưởng cho những khách hàng muốn trải nghiệm không gian nghỉ dưỡng rộng rãi, thoải mái và được trang bị đầy đủ tiện nghi hiện đại."
133,2,"Nội thất trong phòng được thiết kế đơn giản và tinh tế, mang lại cảm giác sang trọng và ấm cúng"
133,3,"Quầy bar mang đến cho du khách nhiều loại đồ uống phong phú, từ cocktail đặc trưng đến rượu vang ngon, đảm bảo đáp ứng tất cả các nhu cầu của khách hàng."
134,1,"Sun halong hotel có đủ không gian để đáp ứng nhu cầu của du khách. Mỗi phòng được thiết kế sang trọng và tiện nghi, đảm bảo mang đến sự thoải mái và thoáng đãng cho khách hàng."
134,2,"Khách sạn cũng rất thích hợp cho gia đình có trẻ em, vì theo chính sách của khách sạn, trẻ em từ 6 tuổi trở xuống được ở miễn phí."
134,3,"Sun halong hotel không chỉ là một điểm đến tuyệt vời để thư giãn và khám phá vẻ đẹp của Hạ Long, mà còn cung cấp cho du khách nhiều tiện ích thể thao tuyệt vời."
134,4,"Sun halong hotel là một khách sạn tuyệt vời tại Hạ Long, Việt Nam, với nhiều tiện ích tiện lợi để đáp ứng nhu cầu của khách hàng."
135,1,"Cửa sổ lớn với tầm nhìn hướng ra thành phố kết hợp cùng rèm cửa, giúp phòng luôn tràn ngập ánh sáng tự nhiên nhưng vẫn đảm bảo sự riêng tư."
135,2,"Hạ Long cuối tuần này trời xanh mây trắng nắng vàng, gió biển mơn man, hải sản tươi ngon kết hợp nghỉ dưỡng tại Essence Hạ Long Hotel chắc chắn là kế hoạch du lịch tuyệt vời, đảm bảo nhà mình ai ai cũng thích"
135,3,Tại Essence Hạ Long Hotel các phòng nghỉ được thiết kế tinh tế đến từng chi tiết với mong muốn đem tới cho quý khách trải nghiệm nghỉ dưỡng xứng tầm
135,4,"Tới Hạ Long và lựa chọn Essence Hạ Long Hotel là điểm dừng chân để chúng tôi giúp bạn tận hưởng những giây phút tuyệt vời, tạo nên thật nhiều khoảnh khắc đáng nhớ"
136,1,"Khách sạn có các phòng được trang bị cơ sở vật chất sang trọng, tiện nghi với cách bài trí hài hòa, ấm cúng tạo nên vẻ lịch sự ở khách sạn"
136,2,"Đội ngũ nhân viên chuyên nghiệp, nhiệt tình luôn mong muốn mang đến cho quý khách dịch vụ tốt nhất, chắc chắn quý khách sẽ cảm thấy hài lòng, tinh thần được thư giãn, thoải mái khi nghỉ tại KL Hạ Long Hotel."
137,1,"Với trái tim kết nối và ý chí mạnh mẽ, từng khách sạn và khu nghỉ dưỡng trong chuỗi sản phẩm mang tên Silk Path Hotels & Resorts mang đến tinh hoa trải nghiệm nghỉ dưỡng, thể hiện dấu ấn văn hóa địa phương và lòng nhiệt thành, mến khách của con người tại từng điểm đến."
137,2,"Từ nội thất tân cổ điển cho tới cách bài trí tinh tế theo tông từng tông màu chủ đạo như vàng – xanh – đỏ, tái hiện không gian cung điện vua chúa thời xưa"
137,3,"Quý khách có thể cảm nhận trọn vẹn sự quý phái, trang nhã mà không kém phần tiện nghi, ấm cúng ngay trong các phòng nghỉ của Silk Path Grand Huế."
137,4,"Thiết kế nội thất hiện đại bên trong phòng ngủ ấm cúng, mang đến sự pha trộn hoàn hảo giữa nét thanh lịch cổ điển và tiện nghi chu đáo."
138,1,Nâng tầm từng sự kiện hội họp với dịch vụ chuyên nghiệp ngay giữa lòng thành phố tại Meliá Vinpearl Huế - nơi đồng hành lý tưởng để mọi cuộc họp luôn hiệu quả và chỉn chu.
138,2,Lưu giữ những kỷ niệm đáng nhớ và cùng gia đình tận hưởng mọi khoảnh khắc sum vầy đầy ý nghĩa tại Meliá Vinpearl Huế - nơi tái hiện không khí lễ hội náo nhiệt bên mỹ vị không giới hạn và các hoạt động gắn kết yêu thương.
138,3,"Nơi đón tiếp những vị khách quý bằng các tiện ích độc quyền, nâng tầm sự khác biệt trong từng dịch vụ được cá nhân hóa, ưu tiên mọi trải nghiệm của du khách luôn thoải mái và riêng tư."
138,4,Ngày mới bắt đầu tràn đầy năng lượng khi được hoà mình thư giãn trong làn nước xanh mát của hồ bơi bốn mùa hay làm nóng cơ thể nơi phòng gym hiện đại tại Meliá Vinpearl Huế.
139,1,"Nằm ở trung tâm, gần nhiều điểm tham quan, ăn uống và mua sắm."
139,2,Hồ bơi tuyệt đẹp được đặt giữa trung tâm Resort
139,3,Nhà hàng chuyên phục vụ hải sản và ẩm thực Á - Âu.
139,4,"Hệ thống phòng hội nghị sức chứa từ 40 - 260 người, với âm thanh ánh sáng đầy đủ."
139,5,"Các tiện ích hấp dẫn khác: Spa, karaoke,dịch vụ đưa đón sân bay,.."
140,1,Vị trí đắc địa hưởng trọn vẻ đẹp thiên nhiên của cả rừng và biển
140,2,"Hồ bơi bốn mùa ngoài trời rộng lớn, có khu vực riêng cho trẻ em"
140,3,Nhà hàng Camia cung cấp ẩm thực đặc trưng làm từ các gia vị địa phương
140,4,"Tiện ích khác: Spa, thuê xe đạp, chèo thuyền trên biển,..."
141,1,"Gần bãi biển Bà Kèo, các khu vui chơi, các điểm tham quan nổi tiếng"
141,2,Hồ bơi riêng với diện tích 800m2
141,3,"Nhà hàng và Sky bar phục vụ thực đơn Âu - Á đa dạng, phong phú"
141,4,"Các dịch vụ tiện ích khác như: Phòng Gym, khu vui chơi trẻ em ,..."
142,1,Bể bơi vô cực dành cho người lớn và trẻ nhỏ.
142,2,"Có nhà hàng với sức chứa lên đến 150 người, phục vụ đa dạng ẩm thực"
142,3,"Phòng hội họp với sức chứa lớn, âm thanh ánh sáng đầy đủ hiện đại nhất"
142,4,Tiện ích khác: Khu vui chơi trẻ em & dịch vụ trông giữ trẻ
143,1,"Nằm ngay trên phố Lê Lợi sát bên bờ sông Hương, từ khách sạn Century, bạn có thể dễ dàng di chuyển và khám phá những điểm đến chất lượng khi ghé Huế mộng mơ vào mùa thu."
143,2,"Khách sạn có không gian rộng lớn nhất nội đô Huế, Century Riverside Huế giống như một resort tọa lạc giữa một khu vườn xanh mát, ngay trong khu vực trung tâm nhìn ra khu “Phố Tây”, nơi mang vẻ đẹp của quá khứ và tương lai trộn lẫn."
143,3,"Lưu lại Century Riverside Huế để được trải nghiệm nét văn hóa thấm nhuần qua ánh nhìn, âm thanh, mùi vị Huế đặc trưng tại một khách sạn mang phong cách bản địa"
143,4,"Tại Century Riverside Huế, bạn sẽ được trải nghiệm trọn vẹn những tinh hoa ẩm thực xứ Huế trong không gian đẹp đẽ nhất, thơ mộng nhất."
144,1,"Khách sạn có phòng nghỉ được trang trí đẹp mắt với tông màu tươi sáng, sàn gỗ, đồ nội thất theo phong cách tân cổ điển và tiện nghi xa hoa. Mọi chi tiết đều được thiết kế cẩn thận để đảm bảo “chạm đến từng cá nhân"
144,2,"Thưởng thức sự sáng tạo ẩm thực tại nhà hàng chính Eldora phục vụ cả ngày, nơi phục vụ nhiều món ăn phương Tây, châu Á và địa phương."
144,3,"Không gian trang trí theo phong cách cổ điển với đồ nội thất cao cấp, đèn tường nến và đèn chùm, Nhà hàng là không gian sang trọng để bàn công việc trong bữa sáng hoặc thư giãn và thưởng thức bữa ăn cùng bạn bè hoặc gia đình."
145,1,"Khách sạn ÊMM Huế được trang bị đầy đủ các dịch vụ & tiện ích từ ăn uống, giải trí đến phòng họp… nhằm mang lại không gian nghỉ dưỡng & công tác trọn vẹn nhất."
145,2,"Dễ dàng nạp lại năng lượng ngay cuối tuần này trong không gian bể bơi xanh mát, thiết kế hiện đại và phục vụ tận tâm của ÊMM Hotel Hue"
145,3,"ọa lạc ngay trung tâm thành phố, dễ dàng tiếp cận mọi điểm đến nổi tiếng của Huế như Sông Hương, Cầu Tràng Tiền, Chợ Đông Ba và Tử Cấm Thành,..."
145,4,"Không gian ấm cúng, gần gũi tại sảnh khách sạn ÊMM Huế, nơi bạn sẽ cảm nhận sự nồng hậu và chân thành của con người xứ Huế ngay từ khoảnh khắc đầu tiên."
146,1,"Khách sạn Jasmine giúp bạn khám phá Huế một cách nhanh chóng và dễ dàng, giúp kì nghỉ của bạn trở nên thư giãn và thích thú."
146,2,Khách sạn Jasmine sẽ mang đến cho bạn quãng thời gian lưu trú thư giãn và dễ chịu nhất có thể.
146,3,"Khi ở tại Khách sạn Jasmine, du khách có thể khám phá Huyen Tran Princess Temple (0,1 km) và Tu Dam Pagoda (1,0 km), những điểm đến hàng đầu của Huế."
146,4,"Huế có rất nhiều nhà hàng kiểu pháp. Vì thế khi ở đây, hãy nhớ thử những điểm ẩm thực yêu thích như Les Jardins de La Carambole, COCOCLUB và Bánh Mì Pháp, phục vụ một số món ăn rất tuyệt vời."
147,1,"Baby Hotel là một lựa chọn tuyệt vời cho khách du lịch khi đến thăm Huế, mang đến những tiện nghi hữu ích cho suốt thời gian lưu trú của bạn."
147,2,"Là “ngôi nhà xa xứ,” các phòng cơ sở kinh doanh có dịch vụ giới hạn cung cấp điều hòa nhiệt độ, tủ lạnh và quầy bar mini, và kết nối mạng thật dễ dàng, với wifi miễn phí sẵn có."
147,3,"Baly Hotel Hue nằm gần An Cuu Market và chỉ cách 15 phút đi bộ từ trung tâm của Huế. Khách sạn này cung cấp xông hơi khô, massage và các hoạt động giải trí, cũng như các phòng khách nhìn ra thành phố."
148,1,"Có bãi biển riêng, hồ bơi ngoài trời gồm khu vực cho trẻ em và người lớn."
148,2,"Hệ thống nhà hàng - bar: Nhà hàng Romance Sea, Bar Dolphin, Bar Pool."
148,3,Pure Spa phục vụ đa dạng liệu pháp chăm sóc sức khỏe và sắc đẹp.
148,4,"Tiện ích khác: phòng gym, bể sục Jacuzzi, khu vui chơi cho trẻ em, phòng tắm hơi,..."
