hotel_id,hotel_name,total_rooms,company_name,hotel_price,city,address,map_link,company_id
1,DeLaSea Phát Linh Hạ Long,326,CÔNG TY CỔ PHẦN ĐẦU TƯ TÂN HOA LƯ,1950000,Hạ Long,"Lô 1, Đại Lộ Hạ Long Marine, Phường Bãi Cháy, TP. Hạ Long, Tỉnh Quảng Ninh",https://maps.app.goo.gl/yxDCjgQvorHL43xX9,1
2,Citadines Marina Hạ Long,580,The Ascott Limited,2000000,Hạ Long,"Bán đảo 3, Marina Halong, Hạ Long, Quảng Ninh",https://maps.app.goo.gl/yseMCyJmvGiZ1t7v9,2
3,Sea Stars Hotel Hạ Long,354,Sea Stars Group,2700000,Hạ Long,"Lô N8-1/Số 47 Cái Dăm, Khu đô thị, Thành phố Hạ Long, Quảng Ninh",https://maps.app.goo.gl/8EyutG7DHVyU4Xf88,3
4,Wyndham Legend Hạ Long,450,CÔNG TY CỔ PHẦN DU LỊCH DỊCH VỤ SAO HẠ LONG,2500000,Hạ Long,"12 Hạ Long, Bãi Cháy, Thành phố Hạ Long, Quảng Ninh",https://maps.app.goo.gl/A5ueMVJi4M7CXhJG7,4
5,Hạ Long Dream Hotel,186,Geleximco Group,1500000,Hạ Long,"số 10 đường Hạ Long, phường Bãi Cháy, Tp. Hạ Long",https://maps.app.goo.gl/EMV8uhrwSEetkPX17,5
6,DLecia Hạ Long ,80,CÔNG TY TNHH VINH QUANG HẠ LONG,1400000,Hạ Long,"Tấn Mài/38 Cái Dăm, Bãi Cháy, Thành phố Hạ Long, Quảng Ninh",https://maps.app.goo.gl/XFintsABhCX4AcNX9,6
7,Grand Fleuve Boutique  Hạ Long,102,CÔNG TY CỔ PHẦN ĐẦU TƯ MINH ĐĂNG,13500000,Hạ Long,"Grand World E101 Sun Plaza, Bãi Cháy, Thành phố Hạ Long, Quảng Ninh",https://maps.app.goo.gl/PQT1qXD6QYLGkEyw6,7
8,Boss Hotel Nha Trang,72,Boss Hotel Nha Trang,700000,Nha Trang,"10 Tôn Đản, phường Lộc Thọ,  thành phố Nha Trang",https://maps.app.goo.gl/KSHsLTBRXLpVJD2CA,8
9,Mường Thanh Grand Hạ Long ,192,CÔNG TY CỔ PHẦN TẬP ĐOÀN MƯỜNG THANH,1500000,Hạ Long,"Ô 7, lô 20 Đông Hùng Thắng, Bãi Cháy, thành phố Hạ Long, tỉnh Quảng Ninh, Việt Nam",https://maps.app.goo.gl/6GaKNa51pvU1X4dA6,9
10,Hạ Long Plaza,200,CÔNG TY TNHH LIÊN DOANH HẠ LONG PLAZA,1200000,Hạ Long,"Số 8 đường Hạ Long, P. Bãi Cháy, TP Hạ Long, Tỉnh Quảng Ninh",https://maps.app.goo.gl/RbDpNZqAw6GkzqUx5,10
11,Royal Khanh Hotel Tuy Hoà,60,CTY TNHH VẬN TẢI THƯƠNG MẠI DỊCH VỤ AN BẢO KHANH,800000,Phú Yên,"68 Nguyễn Huệ, Phường 5, Thành phố Tuy Hoà, Phú Yên","https://www.google.com/maps/place/Kh%C3%A1ch+s%E1%BA%A1n+Royal+Khanh/@13.0891852,109.3137021,15z/data=!4m18!1m8!3m7!1s0x316fec3f678090e3:0x1b417dd1a626ce32!2zNjggTmd1eeG7hW4gSHXhu4csIFBoxrDhu51uZyA1LCBUdXkgSMOyYSwgUGjDuiBZw6puIDYyMDAwMCwgVmnhu4d0IE5hbQ!3b1!8m2!3d13.0918291!4d109.3069429!16s%2Fg%2F11h4cwtsp0!3m8!1s0x316fedef8c5701fd:0x37bb2034ba363293!5m2!4m1!1i2!8m2!3d13.0918291!4d109.3069429!16s%2Fg%2F11fwm787jv?hl=vi-VN&entry=ttu&g_ep=EgoyMDI0MDgyMC4xIKXMDSoASAFQAw%3D%3D",11
12,Sài Gòn Phú Yên Hotel,87,CÔNG TY CỔ PHẦN DU LỊCH SÀI GÒN - PHÚ YÊN,900000,Phú Yên,"541 Trần Hưng Đạo, Phường 6, Thành phố Tuy Hoà, Phú Yên",https://maps.app.goo.gl/8GsotEzAyhox2Fmp6,12
13,Mường Thanh Quy Nhơn,86,Tập đoàn Mường Thanh,1300000,Quy Nhơn,"02 Nguyễn Huệ, Phường Lê Lợi, Thành phố Quy Nhơn, Bình Định",https://maps.app.goo.gl/ybviBzR7cfoa1bYs7,13
14,Anya Hotel Quy Nhơn,229,CÔNG TY CỔ PHẦN ĐẦU TƯ PHÁT TRIỂN DU LỊCH – DỊCH VỤ QUY NHƠN,1400000,Quy Nhơn," 03 Nguyễn Trung Tín, Phường Nguyễn Văn Cừ, Thành phố Quy Nhơn, Bình Định",https://maps.app.goo.gl/n1ArWHkdiZ83YCm6A,14
15,New Century Hotel Hạ Long,100,CÔNG TY CỔ PHẦN XÂY DỰNG DU LỊCH THƯƠNG MẠI BẠCH LONG,1200000,Hạ Long,"Khu Coral Bay, Tổ Hợp BIM 17 tầng, Hoàng Quốc Việt, Hạ Long.",https://maps.app.goo.gl/m6dq7crkJWWk94pB6,15
16,Minasi HANoiOi,30,CÔNG TY CỔ PHẦN MINASI WORLD,1550000,Hà Nội,"30 Bà Triệu, Hoàn Kiếm, Hà Nội",https://maps.app.goo.gl/FwrcgDy75wNwNM386,16
17,Hà Nội Starlight Hotel,30,HANOI STARLIGHT HOTEL,1100000,Hà Nội,"34  Hàng Gà, Hàng Bồ, Hoàn Kiếm, Hà Nội",https://maps.app.goo.gl/BXBiDBEnbL948rXP7,17
18,Affa Boutique Hotel Hà Nội,28,CÔNG TY CỔ PHẦN LƯƠNG THỰC HỒNG HÀ - KHÁCH SẠN AFFA BOUTIQUE,1200000,Hà Nội," 17 Tràng Thi, Phường Hàng Trống, Quận Hoàn Kiếm, Hanoi",https://maps.app.goo.gl/R9nCLqDGmYAkYAYw6,18
19, Ancient Paradise Hotel Hà Nội,32,HANOI ANCIENT PARADISE HOTEL,1400000,Hà Nội,"95 P. Hàng Chiếu, Hàng Buồm, Hoàn Kiếm, Hà Nội",https://maps.app.goo.gl/Ri7QJ3cQR9d3yZbk8,19
20,Meliá Hà Nội,306,Melia Hotels International,51200000,Hà Nội,"44 P. Lý Thường Kiệt, Trần Hưng Đạo, Hoàn Kiếm, Hà Nội",https://maps.app.goo.gl/4YL88BC7nEtrW6tNA,20
21, H Hotel Hà Nội,38,H HOTEL HANOI,2200000,Hà Nội,"76 Hàng Gà, Hàng Bồ, Hoàn Kiếm, Hà Nội ",https://maps.app.goo.gl/zgryBU8Pa768CxR16,21
22,Four Points By Sheraton Đà Nẵng,390,Công ty Cổ phần Địa ốc Alpha Nam Đà Nẵng,2200000,Đà Nẵng,"120 Võ Nguyên Giáp, Street, Sơn Trà, Đà Nẵng",https://maps.app.goo.gl/aXcAZcyYUBd4XgSD7,22
23,Libra Nha Trang Hotel,387,CÔNG TY CỔ PHẦN LIBRA NHA TRANG,800000,Nha Trang," 14 Hùng Vương, Phường Lộc Thọ, Thành phố Nha Trang, Khánh Hòa ",https://maps.app.goo.gl/cSUrMztSDiBgwdhA6,23
24,Bonjour Nha Trang Hotel,102,Bonjour Nha Trang Hotel,800000,Nha Trang,"7/2A Nguyễn Thị Minh Khai, Phường Tân Lập, Thành phố Nha Trang, Khánh Hòa",https://maps.app.goo.gl/46WBD61paVmffY8h9,24
25,Sala Tuy Hoà Beach Hotel,135,Sala Hotel Group,1100000,Phú Yên,"51 Độc Lập, Phường 7, Thành phố Tuy Hoà, Phú Yên",https://maps.app.goo.gl/f52do6CZ8vYfGjmYA,25
26,Grand Tourane Hotel Đà Nẵng ,188,Công ty TNHH TV Thương mại Quảng Nam  – Đà Nẵng – KS Grand Tourane,1800000,Đà Nẵng,"252 Võ Nguyên Giáp, Sơn Trà, Đà Nẵng",https://maps.app.goo.gl/TR357p18vtG1aX6x7,26
27,Phú Yên Everyday Hotel ,95,Phú Yên Everyday Hotel ,1100000,Phú Yên,"251 Hùng Vương, Phường 5, Thành phố Tuy Hoà, Phú Yên",https://maps.app.goo.gl/TCZ28B5cJApRVy6h7,27
28,Hùng Vương Hotel Tuy Hoà,50,Hùng Vương Hotel Tuy Hoà,700000,Phú Yên," 241 ĐL Hùng Vương, Phường 9, Thành phố Tuy Hoà, Phú Yên",https://maps.app.goo.gl/uGy3VCqLHrx1CC189,28
29,La Casa Hotel Tuy Hoà,30,Công Ty TNHH DV và Du lịch Phố Xanh,700000,Phú Yên,"145A Hung Vương, Phường 6, Thành phố Tuy Hoà, Phú Yên",https://maps.app.goo.gl/9U6PGcZrQRAyavoNA,29
30,Aaron Hotel Nha Trang,70,Aaron Hotel Nha Trang,700000,Nha Trang,"06 Trần Quang Khải, Phường Lộc Thọ, Thành phố Nha Trang, Khánh Hòa ",https://maps.app.goo.gl/f11PLTwgVX2eB7vS6,30
31,Red Sun Nha Trang Hotel,145,CÔNG TY TNHH THƯƠNG MẠI DỊCH VỤ NANO,1200000,Nha Trang,"96B Trần Phú, Phường Lộc Thọ, Thành phố Nha Trang, Khánh Hòa (",https://maps.app.goo.gl/dkdQZkJSv4DSa2F98,31
32,Wyndham Đà Nẵng Golden Bay,949,CÔNG TY TNHH HÒA BÌNH – CHI NHÁNH ĐÀ NẴNG,2400000,Đà Nẵng,"01 Lê Văn Duyệt, Nại Hiên Đông, Sơn Trà, thành phố Đà Nẵng",https://maps.app.goo.gl/roCPYQpXdqtWjUVP9,32
33,Mường Thanh Luxury Đà Nẵng,583,Khách sạn Mường Thanh Luxury Đà Nẵng – Chi nhánh  Công ty cổ phần tập đoàn Mường Thanh,1400000,Đà Nẵng,"270 Võ Nguyên Giáp, Phường Mỹ An, Quận Ngũ Hành Sơn, Thành phố Đà Nẵng",https://maps.app.goo.gl/RXJ7uxZ7jPtRDTJd9,33
34,Yarra Ocean Suites Đà Nẵng,102, Yarra Ocean Suites Danang © 2023  Công Ty Cổ Phần Thương Mại Và Dịch Vụ Du Lịch Hùng Bảo Anh,1200000,Đà Nẵng,"304 Võ Nguyên Giáp, Bắc Mỹ An, Ngũ Hành Sơn, Đà Nẵng",https://maps.app.goo.gl/ELTgz3qNhJZX184E8,34
35,The LEAF Boutique Đà Nẵng Hotel,1,Khách sạn The LEAF Da Nang Boutique,1550000,Đà Nẵng,"38 Võ Nguyên Giáp, Phường Mân Thái, Quận Sơn Trà, TP Đà Nẵng, Việt Nam",https://maps.app.goo.gl/yXPqofQjB94TXg1H6,35
36,The Yacht Hạ Long,297,The Yacht Hạ Long by DC,2300000,Hạ Long,"258 Bãi Cháy, Thành phố Hạ Long, Quảng Ninh",https://maps.app.goo.gl/A8vjr3ffuurKnVDY7,36
37,Nha Trang Horizon Hotel,375,Nha Trang Horizon Hotel,1300000,Nha Trang,"102 Dương Hiến Quyền, Phường Vĩnh Hải, Thành phố Nha Trang, Khánh Hòa",https://maps.app.goo.gl/bw82JSprfT7C7An76,37
38,Hilton Garden Inn Đà Nẵng,234,Công ty Cổ phần Đầu tư Thương mại và Xuất nhập khẩu Hải An tại Thành phố Đà Nẵng,1950000,Đà Nẵng,"96 Võ Nguyên Giáp, Mân Thái, Sơn Trà, Đà Nẵng ",https://maps.app.goo.gl/mPf1Wsj7drVKaYAX6,38
39,Sala Grand Tuy Hoà Hotel,226,Sala Hotel Group,1500000,Phú Yên,"09 Độc Lập, Phường 7, Thành phố Tuy Hoà, Phú Yên",https://maps.app.goo.gl/EKKhyhU8G1CFNidRA,25
40,Paracel Beach Hotel Đà Nẵng,165,CÔNG TY TNHH TM& DV DU LỊCH HOÀNG HIẾN,1200000,Đà Nẵng,"204 Võ Nguyên Giáp, Phước Mỹ Sơn Trà, Đà Nẵng, Việt Nam",https://maps.app.goo.gl/yr3QRYaMkd4QC3aN9,39
41,Stelia Beach Resort ,52,CÔNG TY CỔ PHẦN ĐẦU TƯ VÀ KINH DOANH NHÀ VIỆT BEACH,3000000,Phú Yên," Lô C1 Độc Lập, Phường 9, Thành phố Tuy Hoà, Phú Yên ",https://maps.app.goo.gl/zeoNZxugw3SfxC7t5,40
42,Royal Lotus Hotel Đà Nẵng,192,CÔNG TY CỔ PHẦN DU LỊCH VÀ THƯƠNG MẠI HOA PHƯỢNG,1200000,Đà Nẵng," 120 Nguyễn Văn Thoại, Mỹ An,  Ngũ Hành Sơn, Đà Nẵng, Việt Nam",https://maps.app.goo.gl/J2H7hkesdZA5Mmqk7,41
43,Golden Lotus Hotel Đà Nẵng,98,CÔNG TY CỔ PHẦN DỊCH VỤ VÀ DU LỊCH CÁT LÂM,1100000,Đà Nẵng,"200 Trần Bạch Đằng , P. Mỹ An,  Q. Ngũ Hành Sơn, Đà Nẵng, Việt Nam",https://maps.app.goo.gl/skWFn7rn7oNvGEQD6,42
44, Mandala Hotel & Spa Phú Yên,220,Công ty Cổ phần Đầu tư Châu Á - Thái Bình Dương,1500000,Phú Yên," Đại Lộ Hùng Vương, Phường 7, Thành phố Tuy Hoà, Phú Yên",https://maps.app.goo.gl/Wku21Lfywp7kxeWQ7,43
45,Grand Jeep Hotel Đà Nẵng,94,Công Ty TNHH Logistics Kỷ Nguyên Mới,800000,Đà Nẵng,142 - 146 Hồ Nghinh - Sơn Trà - Đà Nẵng,https://maps.app.goo.gl/dcqBm5RBcqPCPWt66,44
46,The Kila Boutique Hotel Quy Nhơn,40,Công ty TNHH PHÚ HẢI,800000,Quy Nhơn,"06 Trương Văn Của, Phường Nguyễn Văn Cừ, Thành phố Quy Nhơn, Bình Định",https://maps.app.goo.gl/yFM5ZVNo7FcarNTn7,45
47,Dylan Hotel Đà Nẵng,50,CHI NHÁNH CÔNG TY TNHH KINH DOANH THƯƠNG MẠI DUNG NAM TẠI ĐÀ NẴNG - KHÁCH SẠN DYLAN,900000,Đà Nẵng,93 - 95 Hà Bổng - Phước Mỹ  Sơn Trà - Đà Nẵng ,https://maps.app.goo.gl/MqmJiqmuRSLiJr7U9,46
48,Sunrise Nha Trang Beach Hotel & Spa,125,Công ty Cổ phần Khách sạn và Dịch vụ Đại Dương (Ocean Hospitality – OCH) ,1500000,Nha Trang,"2 - 14 Trần Phú, Phường Xương Huân, Thành phố Nha Trang, Khánh Hòa ",https://maps.app.goo.gl/VLx9toNX4EqLp6Sd6,47
49,Greenery Hotel Đà Nẵng,20,CÔNG TY TNHH DU LỊCH VÀ KHÁCH SẠN PHƯƠNG LINH KHÁCH SẠN GREENERY ĐÀ NẴNG,750000,Đà Nẵng,"76 Hà Bổng, Đà Nẵng, Việt Nam",https://maps.app.goo.gl/KQ5FYboV3HNgghZW6,48
50,Grand Mercure Đà Nẵng,272,Grand Mercure Danang,2500000,Đà Nẵng,"Lô A1 Khu biệt thự Đảo Xanh, phường Hòa Cường Bắc, quận Hải Châu, Đà Nẵng",https://maps.app.goo.gl/KQR5n18wnndMabr29,49
51,December Hotel Nha Trang,246,CÔNG TY TNHH ĐẦU TƯ MNB VIỆT NAM,1400000,Nha Trang,"289 Nguyễn Thiện Thuật, Phường Lộc Thọ, Thành phố Nha Trang, Khánh Hòa",https://maps.app.goo.gl/EmWq19u4M3QgLrfDA,50
52,Citadines Bayfront Nha Trang Hotel,313,The Ascott Limited,1700000,Nha Trang,"62 Trần Phú, Phường Lộc Thọ, Thành phố Nha Trang, Khánh Hòa",https://maps.app.goo.gl/WdPQyCGP2fnjm2At9,2
53,Paris Deli Hotel Đà Nẵng,103,Khách sạn Paris Deli Đà Nẵng Beach Hotel,1600000,Đà Nẵng,"236 Võ Nguyên Giáp, Phường Phước Mỹ, Quận Sơn Trà, Đà Nẵng",https://maps.app.goo.gl/fjFEdsATC5tCXkDs5,51
54,Vesna Hotel Nha Trang,344,Vesna Hotel Nha Trang,1000000,Nha Trang,"100/6A Trần Phú, Phường Lộc Thọ, Thành phố Nha Trang, Khánh Hòa",https://maps.app.goo.gl/StpJpCf3LYQDy3XJA,52
55,DB Hotel Nha Trang,88,CÔNG TY TNHH THƯƠNG MẠI – DU LỊCH THÁI MINH,800000,Nha Trang,"96A/6/13-14 Trần Phú, Phường Lộc Thọ, Thành phố Nha Trang, Khánh Hòa",https://maps.app.goo.gl/4LbEcoRGAmp5jk8t9,53
56,Imperial Hotel Nha Trang,143,Công ty Cổ phần Du Lịch & Thương Mại Công Thắng,1700000,Nha Trang,"20 Trần Phú, Phường Vĩnh Hòa, Thành phố Nha Trang, Khánh Hòa",https://maps.app.goo.gl/faPg81RqwdoS7xcc6,54
57, Xavia Nha Trang Hotel,180,CÔNG TY CỔ PHẦN ĐẦU TƯ GEDOSICO,1300000,Nha Trang,"09 Hoàng Diệu, Phường Vĩnh Hòa, Thành phố Nha Trang, Khánh Hòa",https://maps.app.goo.gl/ofTFj6tcoY8WpRRg7,55
58,Sala Đà Nẵng Beach Hotel,162,Sala Hotel Group,1600000,,"36 – 38 Lâm Hoành, Sơn Trà, Đà Nẵng, Việt Nam",https://maps.app.goo.gl/V1bc3c3mYFrYXkvQ7,25
59,Peninsula Hotel Đà Nẵng,263,CÔNG TY CỔ PHẦN BĐS CĂN HỘ KS TOKYO GRAND,2000000,Đà Nẵng,"84 Võ Nguyên Giáp, phường Mân Thái, quận Sơn Trà, Thành phố Đà Nẵng,  Việt Nam",https://maps.app.goo.gl/rrnm7SjttVPsAeqj8,56
60,SunKiss Nha Trang Hotel,95,CÔNG TY TNHH KHÁCH SẠN SUN KISS,800000,Nha Trang,"100/8C - 100/C9 Trần Phú, Phường Vĩnh Trường, Thành phố Nha Trang, Khánh Hòa",https://maps.app.goo.gl/MajP8duxNcPRq1e26,57
61,Saphia Hotel Nha Trang,72,Saphia Hotel Nha Trang,700000,Nha Trang," 90-92 Trần Phú, Phường Lộc Thọ, Thành phố Nha Trang, Khánh Hòa",https://maps.app.goo.gl/PtkZ2ajb31pnunhj7,58
62,Meliá Đà Nẵng Beach Resort,264,CÔNG TY TNHH SAO VIỆT NON NƯỚC,3200000,Đà Nẵng,"19 Trường Sa, Hoà Hải, Ngũ Hành Sơn, Đà Nẵng, Việt Nam",https://maps.app.goo.gl/AYnXbAsbNj2mRL9b7,59
63,Asteria Comodo Nha Trang Hotel,241,CÔNG TY CỔ PHẦN ĐẦU TƯ VÀ DỊCH VỤ KHÁCH SẠN THÁI BÌNH DƯƠNG,1300000,Nha Trang,"86A Trần Phú, Phường Lộc Thọ, Thành phố Nha Trang, Khánh Hòa",https://maps.app.goo.gl/rnaaAkTK5BWMYQXe8,60
64,Venue Hotel Nha Trang,64,Venue Hotel Nha Trang,800000,Nha Trang,"24 Tôn Đản, Phường Lộc Thọ, Thành phố Nha Trang, Khánh Hòa ",https://maps.app.goo.gl/FByQs6pGnxSP9byW7,61
65,Lavencos Hotel Đà Nẵng,71,Khách sạn Lavencos,1000000,Bà Rịa - Vũng Tàu,"360 - 362 Võ Nguyên Giáp, Đà Nẵng, Việt Nam",https://maps.app.goo.gl/NMf9vXGvoLN5o9Y38,62
66,Starcity Hotel & Condotel Beachfront Nha Trang,203,CÔNG TY TNHH MTV SAO HÔM NHA TRANG,1600000,Nha Trang,"72 - 74 Đường Trần Phú, Phường Lộc Thọ, Thành Phố Nha Trang, Tỉnh Khánh Hòa",https://maps.app.goo.gl/h4w9vpYnqj9LVfhq7,63
67,M Hotel Đà Nẵng,195,M Group Đà Nẵng,2700000,Đà Nẵng,"286 Võ Nguyên Giáp, Bắc Mỹ Phú, Ngũ Hành Sơn, Đà Nẵng, Việt Nam",https://maps.app.goo.gl/FreNdhUfSprfD35A9,64
68,Prime New Hotel Nha Trang,73,CÔNG TY TNHH ATD –KHÁCH SẠN PRIME NHA TRANG,700000,Nha Trang,"22 Tôn Đản, Phường Lộc Thọ, Thành phố Nha Trang, Khánh Hòa",https://maps.app.goo.gl/wTPjCVz1skHhALq49,65
69,Lotte Hà Nội,318,LOTTE HOTEL VIETNAM,3500000,Hà Nội,"Số 54 Liễu Giai, P. Cống Vị. Ba Đình, Hà Nội",https://maps.app.goo.gl/ZLqV6sHknyyzSLof9,66
70, Silk Queen  Hotel Hà Nội,60,CÔNG TY TNHH ĐỨC ĐỊNH,1700000,Hà Nội,"Số 100 Hàng Gai, Phường Hàng Gai, Quận Hoàn Kiếm, TP. Hà Nội,",https://maps.app.goo.gl/kMShZr9SNZfoCFBN8,67
71,Melia Vinpearl Đà Nẵng Riverfront,864,Melia Vinpearl Hotels & Resort ,2100000,Đà Nẵng,"341 Đ. Trần Hưng Đạo, An Hải Bắc, Sơn Trà, Đà Nẵng",https://maps.app.goo.gl/xJf1hxdwY9oSsYbS7,68
72,HAIAN Riverfront Đà Nẵng,85,Khách sạn HAIAN Riverfront Đà Nẵng,1400000,Đà Nẵng,"182 Bạch Đằng, Street, Hải Châu, Đà Nẵng",https://maps.app.goo.gl/RnFmneNkJgFXGyDY6,69
73,Nha Trang Marriott Resort & Spa,829,Marriott International,2700000,Nha Trang,"Đảo Hòn Tre, Phường Vĩnh Nguyên, Thành phố Nha Trang, Khánh Hòa ",https://maps.app.goo.gl/23fXEH5gCE2iYjK16,70
74,Melia Vinpearl Nha Trang Empire,1221,Melia Hotels Internationl & Vinpearl,2000000,Nha Trang,"44 - 46 Lê Thánh Tôn, Phường Lộc Thọ, Thành phố Nha Trang, Khánh Hòa",https://maps.app.goo.gl/6ZcGZtvVaqnem8d37,71
75,Minawa Kenhga Resort & Spa Ninh Binh,126,CÔNG TY CỔ PHẦN BÁN ĐẢO KÊNH GÀ,3000000,Ninh Bình,"Thôn Kênh Gà, Gia Thịnh, Gia Viễn, Ninh Bình",https://maps.app.goo.gl/6qrFq8dqALJtBNag7,72
76,Tam Coc Lion Kings Hotel & Resort Ninh Bình,26,CÔNG TY TNHH TIẾN HUYỀN,1150000,Ninh Bình,"Thôn Đam Khê Trong, Hoa Lư, Ninh Bình",https://maps.app.goo.gl/VvTn66nZZLwsNJKx9,73
77,Hidden Charm Hotel & Resort Ninh Bình,98,CÔNG TY TNHH THÊU REN MẶT TRỜI XANH,1800000,Ninh Bình,"Số 9, Khu du lịch Tam Cốc – Bích Động, Ninh Thắng, Hoa Lư, Ninh Bình",https://maps.app.goo.gl/uxZkFM5142jG3ryw9,74
78,Melissa Nha Trang Hotel,83,Melissa Nha Trang Hotel,1000000,Nha Trang,"100A2-100A3 Trần Phú, Phường Lộc Thọ, Thành phố Nha Trang, Khánh Hòa",https://maps.app.goo.gl/Zb1YZ9wcwbXdy6Ka8,75
79,Masova Hotel Nha Trang,80,Masova Hotel Nha Trang,1000000,Nha Trang,"100A8 - 100A9 Trần Phú, Phường Lộc Thọ, Thành phố Nha Trang, Khánh Hòa ",https://maps.app.goo.gl/BgSqMEN7jaHwshMt9,76
80,Sunflower Hotel Tuy Hòa,60,Sunflower Hotel Tuy Hòa ,800000,Phú Yên,"341 Lê Duẩn, Phường 7, Thành phố Tuy Hoà, Phú Yên",https://maps.app.goo.gl/rBBMgYrZPCefug5J8,77
81,Salmalia Boutique Hotel & Spa,44,CÔNG TY CỔ PHẦN XÂY DỰNG DỊCH VỤ VÀ THƯƠNG MẠI MỘC MIÊN,1500000,Đà Nẵng,"52 Lâm Hoành, Đà Nẵng, Việt Nam",https://maps.app.goo.gl/2k5CiPLdMcmiMQ138,78
82,M Hotel Phú Quốc,160,M Group,1500000,Phú Quốc,"46 Trần Hưng Đạo, Thị trấn Dương Đông, Thành phố Phú Quốc, Kiên Giang ",https://maps.app.goo.gl/y8iMoZtqY8CWg6XJ7,79
83,Eli Rina Hotel Hà Nội,29,ELI RINA HOTEL,1450000,Hà Nội,"Số 115 Nguyễn Khuyến, Phường Văn Miếu, Quận Đống Đa, Thành phố Hà Nội, Việt Nam",https://maps.app.goo.gl/4X9oFfruAm2Lbk7z8,80
84,Vanda Hotel Đà Nẵng,114,CÔNG TY TNHH BINITIS,1400000,Đà Nẵng,"03 Nguyễn Văn Linh, Đà Nẵng, Việt Nam",https://maps.app.goo.gl/HXmZnkWJz6ZXafNA6,81
85,Angel Hotels Beach Đà Nẵng,1,Angel Hotels Beach Đà Nẵng,1000000,Đà Nẵng,"31 - 32 Đ. Ng. Thì Sĩ, Bắc Mỹ An, Ngũ Hành Sơn, Đà Nẵng, Việt Nam",https://maps.app.goo.gl/4QSt6HeAriramhJV6,82
86,Scenic Mountain Ecolodge Ninh Bình,40,Scenic Mountain Ecolodge Ninh Binh,1400000,Ninh Bình,"Khê Hạ, Hoa Lư, Ninh Bình",https://maps.app.goo.gl/pJsk6Ga5nPucAC7c8,83
87,Leaf Hotel Phú Quốc,29,Leaf Hotel Phú Quốc,700000,,"Suối Mây Cửa Lấp, Xã Dương Tơ, Thành phố Phú Quốc, Kiên Giang ",https://maps.app.goo.gl/j9yggJjUW8bm4iat7,84
88,Sol by Meliá Phú Quốc,284,Melia Hotels Internationl,2500000,Phú Quốc," Khu 1, Khu Du Lịch Đức Việt Khu phức hợp Bãi Trường, Xã Dương Tơ, Thành phố Phú Quốc, Kiên Giang",https://maps.app.goo.gl/5SRGm3veKxNAQiLf8,85
89,VinHolidays Fiesta Phú Quốc,687,Vinpearl Join Stock Company - Vingroup JSC,2000000,Phú Quốc," Khu Bãi Dài, Xã Gành Dầu, Thành phố Phú Quốc, Kiên Giang",https://maps.app.goo.gl/JyvjNPpwzPy8GSTQA,86
90,The Nalod Đà Nẵng,250,Nhà Khách Quốc Hội tại Đà Nẵng,1600000,Đà Nẵng,"192 Võ Nguyên Giáp, Phước Mỹ, Sơn Trà, Đà Nẵng",https://maps.app.goo.gl/52sdcD1qRADt2imq6,87
91,Tahiti Central Hotel Phú Quốc,85,Tahiti Central Hotel Phú Quốc,1000000,Phú Quốc,"Số 51 - 53 Đường Trần Hưng Đạo, Phường Dương Đông, Thành phố Phú Quốc, Kiên Giang",https://maps.app.goo.gl/UouPQYa4WxPEwfcA7,88
92,The Tahiti Beach Hotel Phú Quốc,95,The Tahiti Beach Hotel Phú Quốc,1500000,Phú Quốc,"92A Trần Hưng Đạo, Dương Đông, Thành phố Phú Quốc, tỉnh Kiên Giang",https://maps.app.goo.gl/Brp2tfRNnx7pRAyy6,89
93,Tahiti Resort Phú Quốc,70,Tahiti Resort Phú Quốc,1400000,Phú Quốc,"90 - 92 Trần Hưng Đạo, Phường Dương Đông, Thành phố Phú Quốc, Kiên Giang",https://maps.app.goo.gl/8vtCgCfaEXNtbsuCA,90
94,KOI Resort & Residence Đà Nẵng,135,CÔNG TY CỔ PHẦN DU LỊCH HOÀNG CƯỜNG,3500000,Đà Nẵng,"11 Trường Sa, Hoà Hải, Ngũ Hành Sơn, Đà Nẵng",https://maps.app.goo.gl/9hAbZB58FV5j4YyG7,91
95,M Village Phú Quốc,77,M Group,1300000,Phú Quốc,"169 - 189 Trần Hưng Đạo, Xã Dương Tơ, Thành phố Phú Quốc, Kiên Giang",https://maps.app.goo.gl/kWC8eUQTzR9t4dCJ8,79
96,Crowne Plaza Phú Quốc Starbay ,308,CROWNE PLAZA,2500000,Phú Quốc,"Bãi Dài, Xã Gành Dầu, Thành phố Phú Quốc, Kiên Giang",https://maps.app.goo.gl/JwdRrTBV6pv9cb5D7,92
97,G8 Luxury Hotel and Spa Đà Nẵng,120,G8 Luxury Hotel and Spa Đà Nẵng,1200000,Đà Nẵng,"59 Lê Duẩn, Quận Hải Châu, Đà Nẵng, Việt Nam",https://maps.app.goo.gl/k3FELMYXEcEBQjcw6,93
98,Estrella Boutique Hotel Đà Nẵng,50,Công Ty Cổ Phần Tổng Hợp Sao Biển,1000000,Đà Nẵng,"145 Nguyễn Văn Thoại, An Hải Đông, Sơn Trà, Đà Nẵng",https://maps.app.goo.gl/hmjqbKot6iWcgKJS6,94
99,Amarin Resort & Spa Phú Quốc,96,AMARIN RESORT & SPA,3680000,Phú Quốc,"Trần Hưng Đạo, Xã Dương Tơ, Thành phố Phú Quốc, Kiên Giang ",https://maps.app.goo.gl/cePc2raqFc2sdiko6,95
100,Sunset Beach Resort & Spa Phú Quốc,117, Sunset Beach Resort & Spa,3400000,Phú Quốc," 100/C2 Trần Hưng Đạo, Thị trấn Dương Đông, Thành phố Phú Quốc, Kiên Giang ",https://maps.app.goo.gl/jmnwJE8gfYzrYzbA9,96
101,Mandila Beach Hotel Đà Nẵng,130,Khách sạn Mandila Beach Đà Nẵng.,1300000,Đà Nẵng,"218 Võ Nguyên Giáp, Phước Mỹ, Sơn Trà, Đà Nẵng, Việt Nam",https://maps.app.goo.gl/Qp6MPKV7722CJNMd6,97
102,Rock Mila Phú Quốc Hotel,50,Rock Mila Phú Quốc Hotel,1200000,Phú Quốc,"63/7 Trần Hưng Đạo, Thị trấn Dương Đông, Thành phố Phú Quốc, Kiên Giang",https://maps.app.goo.gl/6iHxfanDgs3qFJDb9,98
103,L'Azure Resort & Spa Phú Quốc,62,L'Azure Resort & Spa Phú Quốc,3000000,Phú Quốc,"64 Trần Hưng Đạo, phường Dương Đông, Thành phố Phú Quốc, Kiên Giang ",https://maps.app.goo.gl/AjqJyYHmakjxxwdB9,99
104,7 Seven Sea Hotel Đà Nẵng,133,Công Ty TNHH Thương Mại Dịch Vụ và Du Lịch Lý Bằng,1700000,Đà Nẵng,"150 Võ Nguyên Giáp, Phước Mỹ, Sơn Trà, Đà Nẵng, Việt Nam",https://maps.app.goo.gl/3MPFwDZQu8tvAFPMA,100
105,Test GG Map,1,ok,2650000,,123 cầu giấy,https://maps.app.goo.gl/7z4ydn8cDddHW1hq8,101
106,Ocean Bay Resort & Spa Phú Quốc,117,CÔNG TY TRÁCH NHIỆM HỮU HẠN MỘT THÀNH VIÊN OCEAN HOUSE  PHÚ QUỐC,2400000,Phú Quốc,"Trần Hưng Đạo, Xã Dương Tơ, Thành phố Phú Quốc, Kiên Giang",https://maps.app.goo.gl/cyaaNA7gEMqfj5Br6,102
107,Đà Nẵng Mikazuki,342,Tập đoàn Khách sạn Mikazuki ,2500000,Đà Nẵng,"Nguyễn Tất Thành, Hoà Hiệp Nam, Liên Chiểu, Đà Nẵng",https://maps.app.goo.gl/re6PYnxDooq39zLVA,103
108,Grand Ocean Bay Resort Phú Quốc,144,CÔNG TY TRÁCH NHIỆM HỮU HẠN MỘT THÀNH VIÊN OCEAN HOUSE  PHÚ QUỐC,3000000,Phú Quốc,"Tổ 5, Ấp Ông Lang, Xã Cửa Dương, Huyện Phú Quốc, Tỉnh Kiên Giang",https://maps.app.goo.gl/FFkGAqs5ib6Xq3WM9,102
109,Lady Hill Sapa Resort,154,Lady Hill Sapa Resort,2950000,SAPA,"Số 4, Nguyễn Chí Thanh, Fansipan, Sapa",https://maps.app.goo.gl/rn8kSC8vyY1TuHPT8,104
110,Fusion Resort & Villas Đà Nẵng,300,Công ty TNHH Khách sạn và Biệt thự Nam Phát,6500000,Đà Nẵng,"1022 Trường Sa, Hoà Hải, Ngũ Hành Sơn, Đà Nẵng, Việt Nam",https://maps.app.goo.gl/4WNmwgiXehqnSyE26,105
111,Santa Garden Resort Phú Quốc,53,SANTA RESORT,1000000,Phú Quốc,"Tổ 1, Ấp Cửa Lấp, xã Dương Tơ, TP. Phú Quốc, Tỉnh Kiên Giang",https://maps.app.goo.gl/KNhLcJdqPJTHv56H9,106
112,Sapa Jade Hill Resort & Spa,66,CÔNG TY CP QUẢN LÝ DỊCH VỤ CAO CẤP ĐỒI NGỌC SA PA,2700000,SAPA," Tổ 3, Phường Cầu Mây, Sapa, Lao Cai",https://maps.app.goo.gl/WsV1vYmnECErZK6d9,107
113,Pao's Sapa Leisure Hote,223,CTX Holdings,2500000,SAPA,"Đường Mường Hoa, Tổ 1, Phường Cầu Mây, Thị Xã Sa Pa, Tỉnh Lào Cai",https://maps.app.goo.gl/qRUJN86g9dvZT3Si7,108
114,KK Sapa,186,CÔNG TY CỔ PHẦN KK SAPA,2500000,SAPA,"036 Đường Mường Hoa, Phường Sapa, Thị Xã Sapa, Tỉnh Lào Cai",https://maps.app.goo.gl/pHF4xj24m8gcTAMt9,109
115,Silk Path Grand Sapa Resort & spa,152,SILK PATH HOTELS & RESORTS,2800000,,"Đồi Quan 6, tổ 5, phường Sa Pa, thị xã Sa Pa, Lào Cai",https://maps.app.goo.gl/bF6GGmswJsz8M5EB8,110
116,Lahana Resort Phú Quốc,83,Công ty TNHH Ha Na Station Phú Quốc,2500000,Phú Quốc,"91/3 Đường Trần Hưng Đạo, Phường Dương Đông, Thành Phố Phú Quốc, Tỉnh Kiên Giang.",https://maps.app.goo.gl/mjWbBd5NQj5b9RtG8,111
117,Best Western Premier Sonasea Phú Quốc Resort ,566,Tập đoàn CEO,3000000,Bà Rịa - Vũng Tàu,"Khu tổ hợp du lịch Sonasea Villas và Resort, Tổ 5, Ấp Đường Bào, Xã Dương Tơ, Thành phố Phú Quốc, Tỉnh Kiên Giang.",https://maps.app.goo.gl/Aopuz2EDTc3MeU5f8,112
118,The Ocean Resort Đà Nẵng,300,VINACAPITAL DANANG RESORT LIMITED,2800000,Đà Nẵng,"Trường Sa, Hoà Hải, Ngũ Hành Sơn, Đà Nẵng, Việt Nam",https://maps.app.goo.gl/FMRE56XCvB2GqHEH9,113
119,Bauhinia Resort & Spa Phú Quốc,39,BAUHINIA RESORT  PHU QUOC,1000000,Phú Quốc,"Ngõ 91 đường Trần Hưng Đạo, Khu phố 7, thị trấn Dương Đông, Phú Quốc, Kiên Giang",https://maps.app.goo.gl/k7b7dndumgA75FCZ6,114
